"Transsituational Individual-Specific Biopsychological Classification of Emotions","S. Walter; J. Kim; D. Hrabal; S. C. Crawcour; H. Kessler; H. C. Traue","Department of Psychosomatic Medicine and Psychotherapy, Medical Psychology, Ulm University, Ulm, Germany; Department of Applied Computer Science, University of Augsburg, Augsburg, Germany; Department of Psychosomatic Medicine and Psychotherapy, Medical Psychology, Ulm University, Ulm, Germany; Department of Clinical Psychology, Dresden University of Technology, Dresden, Germany; Department of Psychiatry, Medical Psychology, Bonn University, Bonn, Germany; Department of Psychosomatic Medicine and Psychotherapy, Medical Psychology, Ulm University, Ulm, Germany","IEEE Transactions on Systems, Man, and Cybernetics: Systems","12 Jun 2013","2013","43","4","988","995","The goal of automatic biopsychological emotion recognition of companion technologies is to ensure reliable and valid classification rates. In this paper, emotional states were induced via a Wizard-of-Oz mental trainer scenario, which is based on the valence-arousal-dominance model. In most experiments, classification algorithms are tested via leave-out cross-validation of one situation. These studies often show very high classification rates, which are comparable with those in our experiment (92.6%). However, in order to guarantee robust emotion recognition based on biopsychological data, measurements have to be taken across several situations with the goal of selecting stable features for individual emotional states. For this purpose, our mental trainer experiment was conducted twice for each subject with a 10-min break between the two rounds. It is shown that there are robust psychobiological features that can be used for classification (70.1%) in both rounds. However, these are not the same as those that were found via feature selection performed only on the first round (classification: 53.0%).","2168-2232","","10.1109/TSMCA.2012.2216869","","https://ieeexplore.ieee.org/stamp/stamp.jsp?arnumber=6466426","Biopsychological analysis;biosignals;emotion recognition;feature selection;transsituational emotion","Emotion recognition;Electromyography;Robustness;Visualization;Cybernetics;Heart rate","","44","","47","IEEE","20 Feb 2013","July 2013","","IEEE","IEEE Journals"
"Cardiovascular Response of Individuals With Spinal Cord Injury to Dynamic Functional Electrical Stimulation Under Orthostatic Stress","T. Yoshida; K. Masani; D. G. Sayenko; M. Miyatani; J. A. Fisher; M. R. Popovic","University of Toronto, Institute of Biomaterials and Biomedical Engineering, Toronto, ON, Canada; Toronto Rehabilitation Institute, Rehabilitation Engineering Laboratory, Toronto, ON, Canada; Toronto Rehabilitation Institute, Rehabilitation Engineering Laboratory, Toronto, ON, Canada; Toronto Rehabilitation Institute, Rehabilitation Engineering Laboratory, Toronto, ON, Canada; Department of Anaesthesia, University of Toronto, Toronto, ON, Canada; University of Toronto, Institute of Biomaterials and Biomedical Engineering, Toronto, ON, Canada",IEEE Transactions on Neural Systems and Rehabilitation Engineering,"4 Jan 2013","2013","21","1","37","46","In this pilot study, we examined how effectively functional electrical stimulation (FES) and passive stepping mitigated orthostatic hypotension in participants with chronic spinal cord injury (SCI). While being tilted head-up to 70° from the supine position, the participants underwent four 10-min conditions in a random sequence: 1) no intervention, 2) passive stepping, 3) isometric FES of leg muscles, and 4) FES of leg muscles combined with passive stepping. We found that FES and passive stepping independently mitigated a decrease in stroke volume and helped to maintain the mean blood pressure. The effects of FES on stroke volume and mean blood pressure were greater than those of passive stepping. When combined, FES and passive stepping did not interfere with each other, but they also did not synergistically increase stroke volume or mean blood pressure. Thus, the present study suggests that FES delivered to lower limbs can be used in individuals with SCI to help them withstand orthostatic stress. Additional studies are needed to confirm whether this use of FES is applicable to a larger population of individuals with SCI.","1558-0210","","10.1109/TNSRE.2012.2211894","","https://ieeexplore.ieee.org/stamp/stamp.jsp?arnumber=6264105","Functional electrical stimulation (FES);orthostatic hypotension;rehabilitation engineering;spinal cord injury (SCI)","Muscles;Blood pressure;Hip;Electrodes;Heart rate;USA Councils;Electromyography","Adult;Blood Pressure;Electric Stimulation Therapy;Female;Humans;Leg;Male;Middle Aged;Muscle, Skeletal;Orthostatic Intolerance;Orthostatic Intolerance;Spinal Cord Injuries;Spinal Cord Injuries;Stroke Volume;Treatment Outcome","22","","47","IEEE","9 Aug 2012","Jan. 2013","","IEEE","IEEE Journals"
"Development of a Non-Contact Sensing Method for Scratching Activity Measurement","Y. Kurihara; T. Kaburagi; K. Watanabe","Department of Industrial and System Engineering, College of Science and Technology, Aoyama Gakuin University, Kanagawa, Japan; Department of Industrial and System Engineering, College of Science and Technology, Aoyama Gakuin University, Kanagawa, Japan; System Control Engineering Department, Faculty of Engineering, Hosei University, Tokyo, Japan",IEEE Sensors Journal,"31 Jul 2013","2013","13","9","3325","3330","The severity of skin diseases accompanied by itch is related to the frequency of itching; thus, the ratio of total scratching time to total measurement time (TST [%]) is a useful index for diagnosing skin diseases such as atopic dermatitis. To grasp the trend of the patient's TST [%], daily monitoring of scratching motion is effective, but it is important to carry out the measurements under unconstrained conditions so as not to burden the patient. In this paper, we propose a non-wearing sensing method for measuring scratching motions while the patient is sleeping. The sensing device used in the proposed method is composed of a piezoceramic sensor sandwiched between two metal plates and placed under the legs of the bed. This sensing device is able to measure micro-vibrations produced by the scratching motion. In carrying out the validation experiment, the TST [%] is obtained using the proposed sensing device. The results are then compared with the TST [%] obtained from conventional, more constrained measurement methods, such as electromyography, ceramic sheets, microphones, strain gauges, acceleration sensors, and gyro sensors. Therefore, the sensing device positioned near the subject's head, where the scratching points are closer together, is capable of determining the TST [%] at an accuracy nearly equal to that of the conventional method that shows the highest accuracy TST [%] among all conventional sensors.","1558-1748","","10.1109/JSEN.2013.2264283","","https://ieeexplore.ieee.org/stamp/stamp.jsp?arnumber=6517477","Scratching;total scratching time;bed monitoring;skin disease;piezoceramics","Sensors;Strain measurement;Skin;Monitoring;Diseases;Legged locomotion;Metals","","12","","13","IEEE","20 May 2013","Sept. 2013","","IEEE","IEEE Journals"
"Predicting Targets of Human Reaching Motions Using Different Sensing Technologies","D. Novak; X. Omlin; R. Leins-Hess; R. Riener","Eidgenossische Technische Hochschule Zurich, Zurich, ZH, CH; Eidgenossische Technische Hochschule Zurich, Zurich, ZH, CH; Institute for Environmental Decisions, ETH Zurich, Zurich, Switzerland; Eidgenossische Technische Hochschule Zurich, Zurich, ZH, CH",IEEE Transactions on Biomedical Engineering,"16 Aug 2013","2013","60","9","2645","2654","Rapid recognition of voluntary motions is crucial in human–computer interaction, but few studies compare the predictive abilities of different sensing technologies. This paper thus compares performances of different technologies when predicting targets of human reaching motions: electroencephalography (EEG), electrooculography, camera-based eye tracking, electromyography (EMG), hand position, and the user's preferences. Supervised machine learning is used to make predictions at different points in time (before and during limb motion) with each individual sensing modality. Different modalities are then combined using an algorithm that takes into account the different times at which modalities provide useful information. Results show that EEG can make predictions before limb motion onset, but requires subject-specific training and exhibits decreased performance as the number of possible targets increases. EMG and hand position give high accuracy, but only once the motion has begun. Eye tracking is robust and exhibits high accuracy at the very onset of limb motion. Several advantages of combining different modalities are also shown, including advantages of combining measurements with contextual data. Finally, some recommendations are given for sensing modalities with regard to different criteria and applications. The information could aid human–computer interaction designers in selecting and evaluating appropriate equipment for their applications.","1558-2531","","10.1109/TBME.2013.2262455","","https://ieeexplore.ieee.org/stamp/stamp.jsp?arnumber=6515157","Human–computer interaction;intention detection;machine learning;physiology;sensor fusion","Electroencephalography;Electromyography;Accuracy;Electrooculography;Sensors;Tracking;Feature extraction","Adult;Artificial Intelligence;Biomedical Engineering;Electrodiagnosis;Female;Humans;Intention;Male;Man-Machine Systems;Movement;Reproducibility of Results;Signal Processing, Computer-Assisted;Task Performance and Analysis;Upper Extremity","45","","26","IEEE","13 May 2013","Sept. 2013","","IEEE","IEEE Journals"
"Automatic Detection of a Subsurface Wire Using an Electromagnetic Gradiometer","S. P. McKenna; K. B. Parkman; L. J. Perren; J. R. McKenna","Naval Postgraduate School, Monterey, CA, USA; U.S. Army Engineer Research and Development Center, Vicksburg, MS, USA; Bevilacqua Research Corporation, Huntsville, AL, USA; U.S. Army Engineer Research and Development Center-Topographic Engineering Center, Alexandria, VA, USA",IEEE Transactions on Geoscience and Remote Sensing,"19 Dec 2012","2013","51","1","132","139","A model-based correlation detection scheme is presented with the aim of detecting and localizing subsurface tunnel infrastructure in an automated fashion. Our goal is to develop a comprehensive detection technology that can be fielded and successfully used by nonexperts, while simultaneously being sufficiently robust as to be effective. Our correlation detection algorithm relies on a library of model signals that are generated using an analytical model of a thin subsurface wire in a homogeneous half-space. The wire is illuminated using an active transmitter source (12, 20, or 200 kHz), and its response is sensed using a man-portable electromagnetic gradiometer (EMG) system. The performance of the detector is assessed using synthetic data and receiver operating characteristic (ROC) analysis as well as experimental data collected during a field test. Preliminary ROC results indicate that at sufficient signal-to-noise ratio, the detector can achieve detection probabilities greater than 0.9 with corresponding false alarm rates of less than one every 1000 m. Results from the field tests revealed that the responses from the EMG can be used to detect and localize (to within 0.5 m in the horizontal) a wire target down to a depth of at least 7 m. We believe the EMG system and correlation detector combine to form a promising technology for detecting tunnel infrastructure that can be used by experts and, more importantly, nonexperts as well.","1558-0644","","10.1109/TGRS.2012.2201162","","https://ieeexplore.ieee.org/stamp/stamp.jsp?arnumber=6236134","Buried object detection;correlation;detection algorithms;electromagnetic induction (EMI)","Correlation;Detectors;Electromyography;Signal to noise ratio;Wires;Conductors;Analytical models","","14","","26","USGov","10 Jul 2012","Jan. 2013","","IEEE","IEEE Journals"
"A Survey on Ambient Intelligence in Healthcare","J. Esch",Proceedings of IEEE Society,Proceedings of the IEEE,"19 Nov 2013","2013","101","12","2467","2469","Ambient intelligence (AmI) is a computing paradigm wherein conventional input and output media no longer exist. Instead, sensors and processors are integrated into conventional objects that harmonize with people in their living situations. AmI relies on artificial intelligence (AI) to perform these duties. It obtains contextual information from embedded sensors, interprets it, and adapts the environment to interpreted needs. The paper provides set of computational methodologies enabling the development of enhanced Aml healthcare applications.","1558-2256","","10.1109/JPROC.2013.2286654","","https://ieeexplore.ieee.org/stamp/stamp.jsp?arnumber=6658293","","Special issues and sections;Medical services;Ambient intelligence;Wireless sensor networks;Artificial intelligence;Robot sensing systems;Transducers;Wireless communication","","20","","","IEEE","19 Nov 2013","Dec. 2013","","IEEE","IEEE Journals"
"Development and Evaluation of a Wristwatch-Type Photoplethysmography Array Sensor Module","Y. K. Lee; J. Jo; H. S. Shin","Electronics and Telecommunications Research Institute, Daejeon, South Korea; Electronics and Telecommunications Research Institute, Daejeon, South Korea; Electronics and Telecommunications Research Institute, Daejeon, South Korea",IEEE Sensors Journal,"26 Mar 2013","2013","13","5","1459","1463","In this paper, we address a new photoplethysmography (PPG) signal-sensing method using a wristwatch-type PPG array sensor. According to the development of the ubiquitous health care system, the many types of medical equipment and treatments have been improved. In conventional PPG signal-sensing approaches, the finger-type PPG probe has been used. However, the finger-type PPG probe requires tight fitting that restricts movement, meaning that patients should endure dome discomfort while wearing it. To solve this problem, we propose a novel PPG array sensor module with a wristwatch-type design. The proposed module measures the PPG signal from the radial artery and the ulnar artery of the wrist, whereas previous methods obtained it from the capillaries of the skin. Moreover, we place phototransistors and infrared-emitting diodes in an array form to improve the PPG signal sensitivity and level of accuracy. Various arrays are considered for optimization, and a conductive rubber wristband is employed to reduce external noise. In the experiments, the proposed module is assessed and compared with the commercial product. This comparison between the commercial finger-type probe dataset and the PPG array module wrist-type probe dataset shows that the degree of similarity between the two signals is greater than 91.2%.","1558-1748","","10.1109/JSEN.2012.2235424","","https://ieeexplore.ieee.org/stamp/stamp.jsp?arnumber=6392844","Mobile device;photoplethysmograph (PPG);U-health;wristwatch-type PPG array sensor","Arrays;Probes;Low pass filters;Arteries;Sensors;Band pass filters;Wrist","","13","","8","IEEE","24 Dec 2012","May 2013","","IEEE","IEEE Journals"
"Far-Field RF Powering of Implantable Devices: Safety Considerations","R. A. Bercich; D. R. Duffy; P. P. Irazoqui","Biomedical Engineering Department, Purdue University, West Lafayette, IN, USA; Biomedical Engineering Department, Purdue University, West Lafayette, IN, USA; Biomedical Engineering Department, Purdue University, West Lafayette, IN, USA",IEEE Transactions on Biomedical Engineering,"15 Jul 2013","2013","60","8","2107","2112","Far-field RF powering is an attractive solution to the challenge of remotely powering devices implanted in living tissue. The purpose of this study is to characterize the peak obtainable power levels in a wireless myoelectric sensor implanted in a patient while maintaining safe local temperature and RF powering conditions. This can serve as a guide for the design of onboard electronics in related medical implants and provide motivation for more efficient power management strategies for implantable integrated circuits. Safe powering conditions and peak received power levels are established using a simplified theoretical analysis and Federal Communications Commission-established limits for radiating antennas. These conditions are subsequently affirmed and improved upon using the finite-element method and temperature modeling in bovine muscle.","1558-2531","","10.1109/TBME.2013.2246787","","https://ieeexplore.ieee.org/stamp/stamp.jsp?arnumber=6461073","Far field;implantable;intramuscular;myoelectric;RF powering;sensors;specific absorption rate (SAR);wireless","Muscles;Radio frequency;Safety;Skin;Implants;Receiving antennas","Body Temperature;Body Temperature;Computer Simulation;Computer-Aided Design;Connective Tissue;Connective Tissue;Electric Power Supplies;Electromagnetic Fields;Energy Transfer;Equipment Design;Equipment Failure Analysis;Equipment Safety;Models, Biological;Prostheses and Implants;Radiation Dosage;Wireless Technology","84","","21","IEEE","12 Feb 2013","Aug. 2013","","IEEE","IEEE Journals"
"A Batteryless 19  $\mu$W MICS/ISM-Band Energy Harvesting Body Sensor Node SoC for ExG Applications","Y. Zhang; F. Zhang; Y. Shakhsheer; J. D. Silver; A. Klinefelter; M. Nagaraju; J. Boley; J. Pandey; A. Shrivastava; E. J. Carlson; A. Wood; B. H. Calhoun; B. P. Otis","University of Virginia, Charlottesville, VA, USA; University of Washington, Seattle, WA, USA; University of Virginia, Charlottesville, VA, USA; University of Washington, Seattle, WA, USA; University of Virginia, Charlottesville, VA, USA; University of Washington, Seattle, WA, USA; University of Virginia, Charlottesville, VA, USA; University of Washington, Seattle, WA, USA; University of Virginia, Charlottesville, VA, USA; University of Washington, Seattle, WA, USA; University of Washington, Seattle, WA, USA; University of Virginia, Charlottesville, VA, USA; University of Washington, Seattle, WA, USA",IEEE Journal of Solid-State Circuits,"31 Dec 2012","2013","48","1","199","213","This paper presents an ultra-low power batteryless energy harvesting body sensor node (BSN) SoC fabricated in a commercial 130 nm CMOS technology capable of acquiring, processing, and transmitting electrocardiogram (ECG), electromyogram (EMG), and electroencephalogram (EEG) data. This SoC utilizes recent advances in energy harvesting, dynamic power management, low voltage boost circuits, bio-signal front-ends, subthreshold processing, and RF transmitter circuit topologies. The SoC is designed so the integration and interaction of circuit blocks accomplish an integrated, flexible, and reconfigurable wireless BSN SoC capable of autonomous power management and operation from harvested power, thus prolonging the node lifetime indefinitely. The chip performs ECG heart rate extraction and atrial fibrillation detection while only consuming 19 μW, running solely on harvested energy. This chip is the first wireless BSN powered solely from a thermoelectric harvester and/or RF power and has lower power, lower minimum supply voltage (30 mV), and more complete system integration than previously reported wireless BSN SoCs.","1558-173X","","10.1109/JSSC.2012.2221217","","https://ieeexplore.ieee.org/stamp/stamp.jsp?arnumber=6399579","Body-area sensors;energy harvesting;subthreshold;ultra-low power","Energy harvesting;System-on-a-chip;Radio frequency;Batteries;Capacitors;Voltage control;Wireless sensor networks","","292","5","25","IEEE","31 Dec 2012","Jan. 2013","","IEEE","IEEE Journals"
"Double-Differential Recording and AGC Using Microcontrolled Variable Gain ASIC","R. Rieger; S. -L. Deng","Electrical Engineering Department, National Sun Yat-Sen University, Kaohsiung, Taiwan; Electrical Engineering Department, National Sun Yat-Sen University, Kaohsiung, Taiwan",IEEE Transactions on Neural Systems and Rehabilitation Engineering,"4 Jan 2013","2013","21","1","47","54","Low-power wearable recording of biopotentials requires acquisition front-ends with high common-mode rejection for interference suppression and adjustable gain to provide an optimum signal range to a cascading analogue-to-digital stage. A microcontroller operated double-differential (DD) recording setup and automatic gain control circuit (AGC) are discussed which reject common-mode interference and provide tunable gain, thus compensating for imbalance and variation in electrode interface impedance. Custom-designed variable gain amplifiers (ASIC) are used as part of the recording setup. The circuit gain and balance is set by the timing of microcontroller generated clock signals. Measured results are presented which confirm that improved common-mode rejection is achieved compared to a single differential amplifier in the presence of input network imbalance. Practical measured examples further validate gain control suitable for biopotential recording and power-line rejection for wearable ECG and EMG recording. The prototype front-end consumes 318 μW including amplifiers and microcontroller.","1558-0210","","10.1109/TNSRE.2012.2213842","","https://ieeexplore.ieee.org/stamp/stamp.jsp?arnumber=6280674","Automatic-gain-control (AGC);biomedical recording;common-mode interference rejection;double-differential amplifier;wearable circuit","Gain;Interference;Electrodes;Automatic generation control;Microcontrollers;Gain control;Electrocardiography","Amplifiers, Electronic;Analog-Digital Conversion;Equipment Design;Equipment Failure Analysis;Feedback;Monitoring, Physiologic;Signal Processing, Computer-Assisted","14","","27","IEEE","23 Aug 2012","Jan. 2013","","IEEE","IEEE Journals"
"What We Think before a Voluntary Movement","L. Schneider; E. Houdayer; O. Bai; M. Hallett",1National Institutes of Health; 1National Institutes of Health; 1National Institutes of Health; 1National Institutes of Health,Journal of Cognitive Neuroscience,"19 May 2014","2013","25","6","822","829","A central feature of voluntary movement is the sense of volition, but when this sense arises in the course of movement formulation and execution is not clear. Many studies have explored how the brain might be actively preparing movement before the sense of volition; however, because the timing of the sense of volition has depended on subjective and retrospective judgments, these findings are still regarded with a degree of scepticism. EEG events such as beta event-related desynchronization and movement-related cortical potentials are associated with the brain's programming of movement. Using an optimized EEG signal derived from multiple variables, we were able to make real-time predictions of movements in advance of their occurrence with a low false-positive rate. We asked participants what they were thinking at the time of prediction: Sometimes they were thinking about movement, and other times they were not. Our results indicate that the brain can be preparing to make voluntary movements while participants are thinking about something else.","0898-929X","","10.1162/jocn_a_00360","","https://ieeexplore.ieee.org/stamp/stamp.jsp?arnumber=6795209","","","","","","","","19 May 2014","June 2013","","MIT Press","MIT Press Journals"
"Top–Down Inhibitory Control Exerted by the Medial Frontal Cortex during Action Selection under Conflict","J. Duque; E. Olivier; M. Rushworth",1Université Catholique de Louvain; 1Université Catholique de Louvain; 2University of Oxford,Journal of Cognitive Neuroscience,"19 May 2014","2013","25","10","1634","1648","Top–down control is critical to select goal-directed actions in changeable environments, particularly when several conflicting options compete for selection. In humans, this control system is thought to involve an inhibitory mechanism that suppresses the motor representation of unwanted responses to favor selection of the most appropriate action. Here, we aimed to evaluate the role of a region of the medial frontal cortex, the pre-SMA, in this form of inhibition by using a double coil TMS protocol combining repetitive TMS (rTMS) over the pre-SMA and a single-pulse TMS over the primary motor cortex (M1) during a visuomotor task that required participants to choose between a left or right button press according to an imperative cue. M1 stimulation allowed us to assess changes in motor excitability related to selected and nonselected (unwanted) actions, and rTMS was used to produce transient disruption of pre-SMA functioning. We found that when rTMS was applied over pre-SMA, inhibition of the nonselected movement representation was reduced. Importantly, this effect was only observed when the imperative cue produced a substantial amount of competition between the response alternatives. These results are consistent with previous studies pointing to a role of pre-SMA in competition resolution. In addition, our findings indicate that this function of pre-SMA involves the control of inhibitory influences directed at unwanted action representations.","0898-929X","","10.1162/jocn_a_00421","","https://ieeexplore.ieee.org/stamp/stamp.jsp?arnumber=6795281","","","","","","","","19 May 2014","Oct. 2013","","MIT Press","MIT Press Journals"
