"Design and Implementation of a Wireless In-Ovo EEG/EMG Recorder","S. Di Pascoli; D. Puntin; A. Pinciaroli; E. Balaban; M. Pompeiano","Dipartimento Ingegneria Informazione, University of Pisa, Pisa, Italy; Dipartimento Ingegneria Informazione, University of Pisa, Pisa, Italy; Dipartimento Ingegneria Informazione, University of Pisa, Pisa, Italy; Dept. of Psychology, McGill University, Montreal, QC, Canada; Dept. of Psychology, McGill University, Montreal, QC, Canada",IEEE Transactions on Biomedical Circuits and Systems,"24 Jan 2014","2013","7","6","832","840","The developmental origins of sleep and brain activity rhythms in higher vertebrate animals (birds and mammals) are currently unknown. In order to create an experimental system in which these could be better elucidated, we designed, built and tested a system for recording EEG and EMG signals in-ovo from chicken embryos incubated for 16-21 days. This system can remain attached to the individual subject through the process of hatching and continue to be worn post-natally. Electrode wires surgically implanted on the head of the embryo are connected to a battery-operated ultraportable transmitter which can either be attached to the eggshell or worn on the back. The transmitter processes up to 6 channels of data with a maximum sampling frequency of 500 Hz and a resolution of 12 bits. The radio link uses a carrier frequency of 4 MHz, and has a maximum transfer rate of 500 kbit/s; receiving antennas compatible with both in-egg recordings and post-natal recordings from freely-moving birds were produced. A receiver connected with one USB port of a PC transmits the data for digital storage. This system is based on discrete, off-the-shelf components, can provide a few days of continuous operation with a single lithium coin battery, and has a noise floor level of 0.35 μV. The transmitter dimensions are 16 × 13 × 1.5 mm and the weight without the battery is 0.7 g. The microprocessor allows flexible operation modes not usually made available in other small multichannel acquisition systems implemented by means of ad hoc mixed signal chips.","1940-9990","","10.1109/TBCAS.2013.2251343","","https://ieeexplore.ieee.org/stamp/stamp.jsp?arnumber=6515714","EEG;embryo;EMG;wireless","Biomedical measurement;Brain modeling;Embryo;Wireless communication;Electroencephalography;Electrodes;Electromyography","Animals;Chick Embryo;Electrodes, Implanted;Electroencephalography;Electromyography;Equipment Design;Telemetry;Wireless Technology","9","","50","IEEE","16 May 2013","Dec. 2013","","IEEE","IEEE Journals"
"Locomotion Mode Classification Using a Wearable Capacitive Sensing System","B. Chen; E. Zheng; X. Fan; T. Liang; Q. Wang; K. Wei; L. Wang","Peking University, Beijing, Beijing, CN; Peking University, Beijing, Beijing, CN; Chinese University of Hong Kong, New Territories, HK; Chinese University of Hong Kong, New Territories, HK; Peking University, Beijing, Beijing, CN; Peking University, Beijing, Beijing, CN; Peking University, Beijing, Beijing, CN",IEEE Transactions on Neural Systems and Rehabilitation Engineering,"4 Sep 2013","2013","21","5","744","755","Locomotion mode classification is one of the most important aspects for the control of powered lower-limb prostheses. We propose a wearable capacitive sensing system for recognizing locomotion modes as an alternative solution to popular electromyography (EMG)-based systems, aiming to overcome drawbacks of the latter. Eight able-bodied subjects and five transtibial amputees were recruited for automatic classification of six common locomotion modes. The system measured ten channels of capacitance signals from the shank, the thigh, or both. With a phase-dependent linear discriminant analysis classifier and selected time-domain features, the system can achieve a satisfactory classification accuracy of $93.6\hbox{\%} \pm 0.9\hbox{\%}$ and $93.4\hbox{\%} \pm 0.8\hbox{\%}$ for able-bodied subjects and amputee subjects, respectively. The classification accuracy is comparable with that of EMG-based systems. More importantly, we verify that neuro-mechanical delay inherent in capacitive sensing does not affect the timeliness of classification decisions as the system, similar to EMG-based systems, can make multiple judgments during a gait cycle. Experimental results also indicate that capacitance signals from the thigh alone are sufficient for mode classification for both able-bodied and transtibial subjects. Our investigations demonstrate that capacitive sensing is a promising alternative to myoelectric sensing for real-time control of powered lower-limb prostheses.","1558-0210","","10.1109/TNSRE.2013.2262952","","https://ieeexplore.ieee.org/stamp/stamp.jsp?arnumber=6517244","Capacitive sensing;linear discriminant analysis (LDA);locomotion mode classification;lower-limb prosthesis;gait classification;wearable sensing system","Shape;Shape measurement;Thigh;Tools;Capacitance;Time measurement;Sensor systems","Adult;Amputation;Amputation, Traumatic;Artificial Limbs;Biomechanical Phenomena;Discriminant Analysis;Electric Capacitance;Electrodes;Electromyography;Electromyography;Electromyography;Female;Functional Laterality;Humans;Locomotion;Lower Extremity;Lower Extremity;Male;Prosthesis Design;Prosthesis Design;Psychomotor Performance;Sweating;Walking;Young Adult","80","","30","IEEE","17 May 2013","Sept. 2013","","IEEE","IEEE Journals"
"Surface Laplacian of Central Scalp Electrical Signals is Insensitive to Muscle Contamination","S. P. Fitzgibbon; T. W. Lewis; D. M. W. Powers; E. W. Whitham; J. O. Willoughby; K. J. Pope","School of Computer Science, Engineering and Mathematics and School of Medicine, Flinders University, Adelaide, SA, Australia; School of Computer Science, Engineering and Mathematics, Flinders University, Adelaide, SA, Australia; School of Computer Science, Engineering and Mathematics, Flinders University, Adelaide, SA, Australia; Department of Neurology, Flinders University and Medical Centre, Adelaide, SA, Australia; The Department of Neurology and Centre for Neuroscience, Flinders University andMedical Centre, Adelaide, SA, Australia; School of Computer Science, Engineering and Mathematics, Flinders University, Adelaide, SA, Australia",IEEE Transactions on Biomedical Engineering,"20 Dec 2012","2013","60","1","4","9","The objective of this paper was to investigate the effects of surface Laplacian processing on gross and persistent electromyographic (EMG) contamination of electroencephalographic (EEG) signals in electrical scalp recordings. We made scalp recordings during passive and active tasks, on awake subjects in the absence and in the presence of complete neuromuscular blockade. Three scalp surface Laplacian estimators were compared to left ear and common average reference (CAR). Contamination was quantified by comparing power after paralysis (brain signal, B) with power before paralysis (brain plus muscle signal, B+M). Brain:Muscle (B:M) ratios for the methods were calculated using B and differences in power after paralysis to represent muscle (M). There were very small power differences after paralysis up to 600 Hz using surface Laplacian transforms (B:M >; 6 above 30 Hz in central scalp leads). Scalp surface Laplacian transforms reduce muscle power in central and pericentral leads to less than one sixth of the brain signal, two to three times better signal detection than CAR. Scalp surface Laplacian transformations provide robust estimates for detecting high-frequency (gamma) activity, for assessing electrophysiological correlates of disease, and also for providing a measure of brain electrical activity for use as a standard in the development of brain/muscle signal separation methods.","1558-2531","","10.1109/TBME.2012.2195662","","https://ieeexplore.ieee.org/stamp/stamp.jsp?arnumber=6188516","Brain;electroencephalographic (EEG);electro-myographic (EMG);paralysis","Laplace equations;Scalp;Muscles;Spline;Surface contamination;Transforms;Electromyography","Adult;Aged;Electroencephalography;Electromyography;Evoked Potentials, Visual;Female;Humans;Male;Middle Aged;Muscle, Skeletal;Scalp;Signal Processing, Computer-Assisted;Task Performance and Analysis","53","","20","IEEE","20 Apr 2012","Jan. 2013","","IEEE","IEEE Journals"
"Reduction of the Linear Reflex Gain Explained From the M1–M2 Refractory Period","A. Klomp; E. de Vlugt; C. G. M. Meskers; J. H. de Groot; J. H. Arendzen; F. C. T. van der Helm","Department of Rehabilitation Medicine, Leiden University Medical Center, Leiden, Netherlands; Department of Biomechanical Engineering, Delft University of Technology, Delft, Netherlands; Department of Rehabilitation Medicine, Leiden University Medical Center, Leiden, Netherlands; Department of Rehabilitation Medicine, Leiden University Medical Center, Leiden, Netherlands; Department of Rehabilitation Medicine, Leiden University Medical Center, Leiden, Netherlands; Department of Biomechanical Engineering, Delft University of Technology, Delft, Netherlands",IEEE Transactions on Biomedical Engineering,"15 May 2013","2013","60","6","1721","1727","Linear system identification methods combined with neuromechanical modeling enable the quantification of reflex gains from recorded joint angular perturbation, torque, and/or electromyography (EMG). However, the stretch reflex response as recorded by EMG consists of multiple consecutive activation volleys (M1 and M2 responses) separated by a period of reduced activity and is nonlinearly related to joint perturbation. The goal of this study is to assess to what extent linear assumptions hold when quantifying these reflexive responses. Series of ramp-and-hold angular perturbations with fixed velocity but different ramp durations (and, therefore, different amplitudes) were applied to the wrist joint of seven healthy volunteers. Evoked EMG responses were compared to the reflex response estimated from a common linear reflex model relating EMG to perturbation velocity. Model fits described the measured EMG responses best when the perturbation and M1 response durations were equivalent. With increasing perturbation duration, i.e., amplitude, EMG response increased but reflex gain decreased due to the inert period after M1, which is believed to be related to alignment of the refractory period of the motoneurons. For angular joint perturbations exceeding the M1 duration (coinciding with 2° of wrist joint rotation in this study), reflex gain variation may be largely explained from a shortcoming of the linear model in describing the nonlinear reflex response, and in particular the period of low reflexive activity after M1.","1558-2531","","10.1109/TBME.2013.2241432","","https://ieeexplore.ieee.org/stamp/stamp.jsp?arnumber=6416029","M1–M2 response;neuromechanics;nonlinearity;reflex gain;stretch reflex","Torque;Electromyography;Joints;Gain;Torque measurement;Wrist","Adult;Biomechanical Phenomena;Electromyography;Female;Humans;Male;Middle Aged;Reflex;Reflex, Stretch;Signal Processing, Computer-Assisted;Torque;Wrist","2","","28","IEEE","21 Jan 2013","June 2013","","IEEE","IEEE Journals"
"Multiscale Entropy Analysis of Different Spontaneous Motor Unit Discharge Patterns","X. Zhang; X. Chen; P. E. Barkhaus; P. Zhou","Sensory Motor Performance Program, Rehabilitation Institute of Chicago, Chicago, IL, USA; Institute of Biomedical Engineering, University of Science and Technology of China, Hefei, Anhui, China; Department of Neurology, Medical College of Wisconsin, Milwaukee Veterans Administration Medical Center, Milwaukee, WI, USA; Department of Physical Medicine and Rehabilitation, Northwestern University, Chicago, IL, USA",IEEE Journal of Biomedical and Health Informatics,"8 Mar 2013","2013","17","2","470","476","This study explores a novel application of multiscale entropy (MSE) analysis for characterizing different patterns of spontaneous electromyogram (EMG) signals including sporadic, tonic and repetitive spontaneous motor unit discharges, and normal surface EMG baseline. Two algorithms for MSE analysis, namely, the standard MSE and the intrinsic mode entropy (IMEn) (based on the recently developed multivariate empirical mode decomposition method), were applied to different patterns of spontaneous EMG. Significant differences were observed in multiple scales of the standard MSE and IMEn analyses (<;i>p<;/i> <; 0.001) for any two of the spontaneous EMG patterns, while such significance may not be observed from the single-scale entropy analysis. Compared to the standard MSE, the IMEn analysis facilitates usage of a relatively low scale number to discern entropy difference among various patterns of spontaneous EMG signals. The findings from this study contribute to our understanding of the nonlinear dynamic properties of different spontaneous EMG patterns, which may be related to spinal motoneuron or motor unit health.","2168-2208","","10.1109/JBHI.2013.2241071","","https://ieeexplore.ieee.org/stamp/stamp.jsp?arnumber=6415231","Motor unit action potential;multiscale entropy;spontaneous muscle activity;surface electromyography","Entropy;Electromyography;Standards;Time series analysis;Discharges (electric);Algorithm design and analysis;Firing","Action Potentials;Aged;Algorithms;Analysis of Variance;Arm;Electromyography;Entropy;Female;Humans;Male;Middle Aged;Muscle, Skeletal;Signal Processing, Computer-Assisted","39","","32","IEEE","18 Jan 2013","March 2013","","IEEE","IEEE Journals"
"A Quasi-Optimal Channel Selection Method for Bioelectric Signal Classification Using a Partial Kullback–Leibler Information Measure","T. Shibanoki; K. Shima; T. Tsuji; A. Otsuka; T. Chin","Graduate school of Engineering, Hiroshima University, Hiroshima, Japan; Graduate School of Biomedical Sciences, Hiroshima University, Hiroshima, Japan; Graduate school of Engineering, Hiroshima University, Hiroshima, Japan; Faculty of Welfare and Healthcare, Prefectural University of Hiroshima, Hiroshima, Japan; Hyogo Rehabilitation Center, Hyogo, Japan",IEEE Transactions on Biomedical Engineering,"11 Mar 2013","2013","60","3","853","861","This paper proposes a novel variable selection method involving the use of a newly defined metric called the partial Kullback-Leibler (KL) information measure to evaluate the contribution of each variable (dimension) in the data. In this method, the probability density functions of recorded data are estimated through a multidimensional probabilistic neural network trained on the basis of KL information theory. The partial KL information measure is then defined as the ratio of the values before and after dimension elimination in the data. The effective dimensions for classification can be selected eliminating ineffective ones based on the partial KL information in a one-by-one manner. In the experiments, the proposed method was applied to channel selection with nine subjects (including an amputee), and effective channels were selected from all channels attached to each subject's forearm. The results showed that the number of channels was reduced by 54.3 ±19.1%, and the average classification rate for evaluation data using selected three or four channels was 96.6 ±2.8% (min: 92.1%, max: 100%). These outcomes indicate that the proposed method can be used to select effective channels (optimal or quasi-optimal) for accurate classification.","1558-2531","","10.1109/TBME.2012.2205990","","https://ieeexplore.ieee.org/stamp/stamp.jsp?arnumber=6225425","Channel selection;electromyogram (EMG);Kullback–Leibler (KL) information;pattern classification;variable selection method","Electromyography;Electrodes;Input variables;Vectors;Accuracy;Feature extraction;Probability density function","Algorithms;Electromyography;Electromyography;Forearm;Humans;Motor Activity;Neural Networks (Computer);Signal Processing, Computer-Assisted;Young Adult","18","","29","IEEE","25 Jun 2012","March 2013","","IEEE","IEEE Journals"
"MEMS-Based Intraoperative Monitoring System for Improved Safety in Lumbar Surgery","X. Liu; H. Chen; Q. -A. Huang; D. J. Young","Key Laboratory of MEMS of Ministry of Education, Southeast University, Nanjing, China; Medical College, Southeast University, Nanjing, China; Key Laboratory of MEMS of Ministry of Education, Southeast University, Nanjing, China; Department of Electrical and Computer Engineering, University of Utah, Salt Lake, UT, USA",IEEE Sensors Journal,"27 Mar 2013","2013","13","5","1541","1548","This paper presents the design and characterization of a microelectromechanical system (MEMS)-based intraoperative monitoring system for improving lumbar surgery safety. A MEMS pressure-sensing module is designed and incorporated into a nerve root retractor tip to directly monitor pressure exerted on a nerve root during a lumbar surgery. Animal experiments are conducted for intraoperative pressure monitoring to investigate effects of nerve root retraction during a surgery. Amplitude and latency of electrophysiological response of a nerve root are measured during different time intervals after retraction under various retraction magnitude and duration conditions. Correlation between exerted pressure on a retracted nerve root and its electrophysiological response is investigated. The relationship between intraoperative pressure and alteration of neural tissue structure is analyzed by morphological observation. Experimental results indicate that a nerve root injury is strongly related to the magnitude and duration of its retraction. The prototype MEMS-based intraoperative monitoring system can potentially alert surgeons about risk factors associated with nerve root injury during a lumbar surgery as well as provide critical surgical guidelines. The system can also serve as a basis for implementing an intelligent robotically controlled closed-loop lumbar surgical operating system in the future.","1558-1748","","10.1109/JSEN.2013.2243141","","https://ieeexplore.ieee.org/stamp/stamp.jsp?arnumber=6482581","Iatrogenic nerve root injury;intraoperative monitoring system;intraoperative pressure monitoring;lumbar surgery;silicon pressure sensor","Monitoring;Surgery;Injuries;Electromyography;Pressure measurement;Micromechanical devices;Sensors","","1","","24","IEEE","20 Mar 2013","May 2013","","IEEE","IEEE Journals"
"Real-Time Evaluation of a Noninvasive Neuroprosthetic Interface for Control of Reach","E. A. Corbett; K. P. Körding; E. J. Perreault","Department of Biomedical Engineering, Northwestern University, Evanston, IL, USA; Department of Physiology and the Department of Physical Medicine and Rehabilitation, Northwestern University, Chicago, IL, USA; Department of Biomedical Engineering and the Department of Physical Medicine and Rehabilitation, Northwestern University, Chicago, IL, USA",IEEE Transactions on Neural Systems and Rehabilitation Engineering,"2 Jul 2013","2013","21","4","674","683","Injuries of the cervical spinal cord can interrupt the neural pathways controlling the muscles of the arm, resulting in complete or partial paralysis. For individuals unable to reach due to high-level injuries, neuroprostheses can restore some of the lost function. Natural, multidimensional control of neuroprosthetic devices for reaching remains a challenge. Electromyograms (EMGs) from muscles that remain under voluntary control can be used to communicate intended reach trajectories, but when the number of available muscles is limited control can be difficult and unintuitive. We combined shoulder EMGs with target estimates obtained from gaze. Natural gaze data were integrated with EMG during closed-loop robotic control of the arm, using a probabilistic mixture model. We tested the approach with two different sets of EMGs, as might be available to subjects with C4and C5-level spinal cord injuries. Incorporating gaze greatly improved control of reaching, particularly when there were few EMG signals. We found that subjects naturally adapted their eye-movement precision as we varied the set of available EMGs, attaining accurate performance in both tested conditions. The system performs a near-optimal combination of both physiological signals, making control more intuitive and allowing a natural trajectory that reduces the burden on the user.","1558-0210","","10.1109/TNSRE.2013.2251664","","https://ieeexplore.ieee.org/stamp/stamp.jsp?arnumber=6480882","Electromyography;eye tracking;Kalman filter;mixture model;motor neuroprostheses","Electromyography;Decoding;Trajectory;Robot kinematics;Training;Injuries","Algorithms;Arm;Arm;Biomechanical Phenomena;Brain-Computer Interfaces;Electric Stimulation;Electroencephalography;Electromyography;Eye Movements;Female;Fixation, Ocular;Humans;Male;Muscle, Skeletal;Muscle, Skeletal;Neural Prostheses;Online Systems;Practice (Psychology);Prosthesis Design;Psychomotor Performance;Robotics;Spinal Cord Injuries;Young Adult","30","","37","IEEE","15 Mar 2013","July 2013","","IEEE","IEEE Journals"
"Magnetic Stimulation of the Spinal Cord: Experimental Results and Simulations","L. Darabant; M. Cretu; A. Darabant","Electrotechnics Department, Technical University of Cluj Napoca, Cluj-Napoca, Romania; Electrotechnics Department, Technical University of Cluj Napoca, Cluj-Napoca, Romania; Computer Science Department, Babes Bolyai University, Cluj-Napoca, Romania",IEEE Transactions on Magnetics,"7 May 2013","2013","49","5","1845","1848","This paper aims in interpreting the leg muscles responses recorded by electromyography during magnetic stimulation of the spinal cord by computing the electric field induced in the spinal cord and the nearby areas during this procedure. A simplified model of the spine was created and a Finite Difference Method algorithm was implemented in Matlab.","1941-0069","","10.1109/TMAG.2013.2242877","","https://ieeexplore.ieee.org/stamp/stamp.jsp?arnumber=6514776","Electromyography;finite difference method;magnetic stimulation;spinal cord","Coils;Spinal cord;Muscles;Magnetic stimulation;Computational modeling;Electric potential;Mathematical model","","8","","7","IEEE","7 May 2013","May 2013","","IEEE","IEEE Journals"
"Development of a Low-cost Upper-limb Myoelectrical Prosthestis and its Open Source Training System","A. Diaz Nocera; D. A. Beltramone","Universidad Nacional de Córdoba, Argentina; Universidad Nacional de Córdoba, Argentina",IEEE Latin America Transactions,"23 Apr 2013","2013","11","1","162","167","Bioelectrical signals are used more frequently in order to provide an alternative way to command devices, such as myoelectrical signals or electroencephalic signals -the last ones used in Brain-Computer Interface applications-. The goal of this paper is using myoelectrical signals to command a robotic upperlimb prosthesis developed as well. The only requirement to be able to use the prosthesis would be to have a voluntary and accurate muscle control. In that way, a training system for prosthesis' future users has been developed in order to train their muscle control.","1548-0992","","10.1109/TLA.2013.6502796","","https://ieeexplore.ieee.org/stamp/stamp.jsp?arnumber=6502796","Myoelectric prosthesis;myoelectrical signal;training system;upper-limb","Software;Training;Electromyography;Solid modeling;Visualization;Prosthetics;Hardware","","","","","IEEE","23 Apr 2013","Feb. 2013","","IEEE","IEEE Journals"
"An Integrated Amplifier With Passive Neutralization of Myoelectric Interference From Neural Recording Tripoles","A. Demosthenous; I. Pachnis; D. Jiang; N. Donaldson","University College London, Department of Electronic and Electrical Engineering, London, U.K.; Infineon Technologies, Villach, AG, Austria; University College London, Department of Electronic and Electrical Engineering, London, U.K.; University College London, Department of Medical Physics and Bioengineering, London, U.K.",IEEE Sensors Journal,"31 Jul 2013","2013","13","9","3236","3248","This paper describes an integrated amplifier for neural recording from tripolar electrode books connected in the quasi-tripole arrangement. The same tripole is used in the implant for neural stimulation. To remove myoelectric interference from neural recordings, a resistor–capacitor network is used to balance the electrode impedances in the tripole. The amplifier is programmable (recording mode, passband, gain, and trimming impedance) via a serial peripheral interface. Its front-end instrumentation amplifier employs current feedback to achieve high common-mode rejection ratio. The circuit was implemented in 0.35- $\mu{\rm m}$ CMOS technology and occupies an area of ${\sim}{\rm 1.2}~{\rm mm}^{2}$. In the very-low noise mode, the analog front-end features a maximum of 0.68 $\mu{\rm V}_{\rm rms}$ input-referred noise in the passband and consumes ${\sim}{\rm 310}~\mu{\rm A}$ from a 3 V supply. The measured common-mode rejection ratio of the instrumentation amplifier $({\rm CMRR}_{\rm IA})$ approaches 100 dB. The effect of component mismatch on the  ${\rm CMRR}_{\rm IA}$ and the noise performance of the instrumentation amplifier are examined. In addition, the recording tripole is analyzed to derive the overall common-mode rejection ratio that is shown to exceed 80 dB. The ability of the neural amplifier to reduce myoelectric interference is demonstrated. The amplifier is also tested with a tripole immersed in saline in the stimulate-record mode.","1558-1748","","10.1109/JSEN.2013.2271477","","https://ieeexplore.ieee.org/stamp/stamp.jsp?arnumber=6548057","Implantable circuits;instrumentation amplifier;low noise;myoelectric interference;neural recording;neural stimulation;stimulator;tripole","Electrodes;Instruments;Noise;Interference;Switches;CMOS technology;Recording;Sensors;Passband;Gain","","29","","29","IEEE","27 Jun 2013","Sept. 2013","","IEEE","IEEE Journals"
