ID,Title,Assigned_Categories
314,EMG of the tibialis anterior demonstrates a training effect after utilization of a foot drop stimulator.,"Biomechanics & Kinematics, Rehabilitation & Therapy, Neurophysiology"
315,"Intuitive, Online, Simultaneous, and Proportional Myoelectric Control Over Two Degrees-of-Freedom in Upper Limb Amputees","Biomechanics & Kinematics, Rehabilitation & Therapy, HCI & Prosthetics, Sports & Ergonomics"
316,Actigraphy combined with EEG compared to polysomnography in sleep apnea patients.,"Clinical & Diagnostic, Biomechanics & Kinematics, Neurophysiology"
317,Effect of lace-up ankle braces on electromyography measures during walking in adults with chronic ankle instability.,"Biomechanics & Kinematics, Rehabilitation & Therapy, Neurophysiology"
318,"Anti-fatigue mats, low back pain, and electromyography: An interventional study.","Clinical & Diagnostic, Rehabilitation & Therapy, Sports & Ergonomics"
319,Surface EMG Decomposition Based on K-means Clustering and Convolution Kernel Compensation,"Biomechanics & Kinematics, Neurophysiology, Sports & Ergonomics"
320,High-Density Electromyography and Motor Skill Learning for Robust Long-Term Control of a 7-DoF Robot Arm,HCI & Prosthetics
321,Implementation of EMG- and Force-Based Control Interfaces in Active Elbow Supports for Men With Duchenne Muscular Dystrophy: A Feasibility Study,"Biomechanics & Kinematics, Rehabilitation & Therapy, HCI & Prosthetics, Sports & Ergonomics"
322,Neuromuscular performance of Bandal Chagui: Comparison of subelite and elite taekwondo athletes.,"Biomechanics & Kinematics, Rehabilitation & Therapy, Neurophysiology, Sports & Ergonomics"
323,Cascaded Adaptation Framework for Fast Calibration of Myoelectric Control,"Clinical & Diagnostic, Rehabilitation & Therapy, HCI & Prosthetics, Sports & Ergonomics"
324,Comparing electro- and mechano-myographic muscle activation patterns in self-paced pediatric gait.,"Clinical & Diagnostic, Biomechanics & Kinematics"
325,Does short-term gluteal activation enhance muscle performance?,"Biomechanics & Kinematics, Rehabilitation & Therapy, HCI & Prosthetics, Sports & Ergonomics"
326,Electromyographic analysis of gluteus maximus and hamstring activity during the supine resisted hip extension exercise versus supine unilateral bridge to neutral.,"Clinical & Diagnostic, Biomechanics & Kinematics, Rehabilitation & Therapy, Neurophysiology"
327,Correlation and compatibility between surface respiratory electromyography and transesophageal diaphragmatic electromyography measurements during treadmill exercise in stable patients with COPD.,"Clinical & Diagnostic, Rehabilitation & Therapy, Neurophysiology"
328,Application of Empirical Mode Decomposition Combined With Notch Filtering for Interpretation of Surface Electromyograms During Functional Electrical Stimulation.,"Clinical & Diagnostic, Biomechanics & Kinematics, Rehabilitation & Therapy, HCI & Prosthetics, Neurophysiology, Sports & Ergonomics"
329,Gait analysis on force treadmill in children: comparison with results from ground-based force platforms.,"Biomechanics & Kinematics, Rehabilitation & Therapy"
330,An EMG-to-Force Processing Approach for Estimating in Vivo Hip Muscle Forces in Normal Human Walking,"Clinical & Diagnostic, Biomechanics & Kinematics, Neurophysiology"
331,Myoelectric Activation Pattern Changes in the Involved Limb of Individuals With Transtibial Amputation During Locomotor State Transitions.,"Clinical & Diagnostic, Biomechanics & Kinematics, HCI & Prosthetics"
332,Ischemic conditioning increases strength and volitional activation of paretic muscle in chronic stroke: a pilot study.,"Biomechanics & Kinematics, Rehabilitation & Therapy, Neurophysiology, Sports & Ergonomics"
334,Classification of Transient Myoelectric Signals for the Control of Multi-Grasp Hand Prostheses,"Rehabilitation & Therapy, HCI & Prosthetics, Neurophysiology, Sports & Ergonomics"
335,Abdominal and pelvic floor electromyographic analysis during abdominal hypopressive gymnastics.,Biomechanics & Kinematics
336,Evaluation of integral electromyographic values and median power frequency values in women with myogenous temporomandibular disorder and asymptomatic controls.,"Clinical & Diagnostic, HCI & Prosthetics, Neurophysiology, Sports & Ergonomics"
337,IMU-Based Wrist Rotation Control of a Transradial Myoelectric Prosthesis,"Biomechanics & Kinematics, HCI & Prosthetics, Sports & Ergonomics"
338,sEMG-Based Detection of Compensation Caused by Fatigue During Rehabilitation Therapy: A Pilot Study,"Clinical & Diagnostic, Rehabilitation & Therapy, HCI & Prosthetics, Neurophysiology, Sports & Ergonomics"
339,Revisited relationships between probable sleep bruxism and clinical muscle symptoms.,"Clinical & Diagnostic, Biomechanics & Kinematics, Rehabilitation & Therapy, Sports & Ergonomics"
341,Online Finger Control Using High-Density EMG and Minimal Training Data for Robotic Applications,"Clinical & Diagnostic, Biomechanics & Kinematics, Rehabilitation & Therapy, HCI & Prosthetics, Neurophysiology, Sports & Ergonomics"
342,Acute skeletal muscle responses to very low-load resistance exercise with and without the application of blood flow restriction in the upper body.,"Biomechanics & Kinematics, Rehabilitation & Therapy, Sports & Ergonomics"
343,Surface Electromyography Based Estimation of Knee Joint Angle by Using Correlation Dimension of Wavelet Coefficient,"Biomechanics & Kinematics, Rehabilitation & Therapy, HCI & Prosthetics"
344,Research on Recognition of Nine Kinds of Fine Gestures Based on Adaptive AdaBoost Algorithm and Multi-Feature Combination,HCI & Prosthetics
345,Effects of the head lift exercise and neuromuscular electrical stimulation on swallowing muscles activity in healthy older adults: a randomized pilot study.,"Clinical & Diagnostic, Rehabilitation & Therapy, Neurophysiology"
346,The Effect of Feedback During Training Sessions on Learning Pattern-Recognition-Based Prosthesis Control,"Rehabilitation & Therapy, HCI & Prosthetics, Sports & Ergonomics"
347,EMG-Force and EMG-Target Models During Force-Varying Bilateral Hand-Wrist Contraction in Able-Bodied and Limb-Absent Subjects,"Biomechanics & Kinematics, Neurophysiology, Sports & Ergonomics"
348,Resilient EMG Classification to Enable Reliable Upper-Limb Movement Intent Detection,"Biomechanics & Kinematics, Rehabilitation & Therapy, HCI & Prosthetics"
349,A Novel Postprocessing Method for Robust Myoelectric Pattern-Recognition Control Through Movement Pattern Transition Detection,"Biomechanics & Kinematics, HCI & Prosthetics, Sports & Ergonomics"
350,A Novel Point-in-Polygon-Based sEMG Classifier for Hand Exoskeleton Systems,"Rehabilitation & Therapy, HCI & Prosthetics, Sports & Ergonomics"
351,Unsupervised Domain Adversarial Self-Calibration for Electromyography-Based Gesture Recognition,"Biomechanics & Kinematics, HCI & Prosthetics, Neurophysiology, Sports & Ergonomics"
352,"Effects of Chewing Exerciser on the Recovery of Masticatory Function Recovery after Orthognathic Surgery: A Single-Center Randomized Clinical Trial, a Preliminary Study.","Clinical & Diagnostic, Biomechanics & Kinematics, Rehabilitation & Therapy, HCI & Prosthetics"
353,The Application of Manual Techniques in Masticatory Muscles Relaxation as Adjunctive Therapy in the Treatment of Temporomandibular Joint Disorders.,"Clinical & Diagnostic, Biomechanics & Kinematics, Rehabilitation & Therapy, HCI & Prosthetics"
354,"Effect of two Dynamic Tape™ applications on the electromyographic activity of the gluteus medius and functional performance in women: A randomized, controlled, clinical trial.","Clinical & Diagnostic, Biomechanics & Kinematics, Sports & Ergonomics"
355,A Dual-Modal Approach Using Electromyography and Sonomyography Improves Prediction of Dynamic Ankle Movement: A Case Study,"Clinical & Diagnostic, Biomechanics & Kinematics, Rehabilitation & Therapy, HCI & Prosthetics, Sports & Ergonomics"
356,"Effects of combined whole body vibration and resistance training on lower quadrants electromyographic activity, muscle strength and power in athletes.","Biomechanics & Kinematics, Rehabilitation & Therapy, Neurophysiology, Sports & Ergonomics"
357,"Wearable myoelectric interface enables high-dose, home-based training in severely impaired chronic stroke survivors.","Clinical & Diagnostic, Rehabilitation & Therapy, HCI & Prosthetics, Sports & Ergonomics"
358,The Effect of Fatigue on Wheelchair Users’ Upper Limb Muscle Coordination Patterns in Time-Frequency and Principal Component Analysis,"Clinical & Diagnostic, Biomechanics & Kinematics, Rehabilitation & Therapy, Neurophysiology, Sports & Ergonomics"
359,Effect of Robotic Exoskeleton Motion Constraints on Upper Limb Muscle Synergies: A Case Study,"Clinical & Diagnostic, Rehabilitation & Therapy, HCI & Prosthetics"
360,Effect of electromyographic biofeedback training on motor function of quadriceps femoris in patients with incomplete spinal cord injury: A randomized controlled trial.,"Clinical & Diagnostic, Rehabilitation & Therapy, HCI & Prosthetics"
361,Effects of Comprehensive Swallowing Intervention on Obstructive Sleep Apnea and Dysphagia After Stroke: A Randomized Controlled Trial.,"Clinical & Diagnostic, Rehabilitation & Therapy, HCI & Prosthetics"
362,Measuring Neuromuscular Electrophysiological Activities to Decode HD-sEMG Biometrics for Cross-Application Discrepant Personal Identification With Unknown Identities,"Rehabilitation & Therapy, HCI & Prosthetics, Neurophysiology, Sports & Ergonomics"
363,"Effect of Foot Reflexology on Muscle Electrical Activity, Pressure, Plantar Distribution, and Body Sway in Patients with Type 2 Diabetes Mellitus: A Pilot Randomized Controlled Trial.","Clinical & Diagnostic, Biomechanics & Kinematics, Rehabilitation & Therapy, HCI & Prosthetics"
364,5-HT(2) receptor antagonism reduces human motoneuron output to antidromic activation but not to stimulation of corticospinal axons.,Neurophysiology
365,An Evaluation of an Innovative Exercise to Relieve Chronic Low Back Pain in Sedentary Workers.,"Clinical & Diagnostic, Biomechanics & Kinematics, Rehabilitation & Therapy, HCI & Prosthetics, Sports & Ergonomics"
366,Electrode Shift Robust CNN for High-Density Myoelectric Pattern Recognition Control,"HCI & Prosthetics, Neurophysiology, Sports & Ergonomics"
367,"Emotion Recognition With Audio, Video, EEG, and EMG: A Dataset and Baseline Approaches","HCI & Prosthetics, Neurophysiology, Sports & Ergonomics"
368,Silent Speech Recognition Based on Surface Electromyography Using a Few Electrode Sites Under the Guidance From High-Density Electrode Arrays,"HCI & Prosthetics, Neurophysiology, Sports & Ergonomics"
369,Impact of resistance training on muscle fatigue in type 2 diabetes mellitus patients during dynamic fatigue protocol.,"Clinical & Diagnostic, Biomechanics & Kinematics, Rehabilitation & Therapy, HCI & Prosthetics, Neurophysiology, Sports & Ergonomics"
370,A Novel and Efficient Surface Electromyography Decomposition Algorithm Using Local Spatial Information,"HCI & Prosthetics, Neurophysiology"
371,A Novel Lower-Limb Coordination Assessment Scheme Using Multi-Scale Nonlinear Coupling Characteristics With sEMG,"Clinical & Diagnostic, HCI & Prosthetics, Sports & Ergonomics"
372,Real-Time Hand Gesture Recognition by Decoding Motor Unit Discharges Across Multiple Motor Tasks From Surface Electromyography,"HCI & Prosthetics, Neurophysiology, Sports & Ergonomics"
373,Single-Channel sEMG-Based Estimation of Knee Joint Angle Using a Decomposition Algorithm With a State-Space Model,"Biomechanics & Kinematics, Rehabilitation & Therapy, HCI & Prosthetics, Sports & Ergonomics"
374,Surface electromyography evaluation of selected manual and physical therapy interventions in women with temporomandibular joint pain and limited mobility. Randomized controlled trial (RCT).,"Clinical & Diagnostic, Biomechanics & Kinematics, Rehabilitation & Therapy, HCI & Prosthetics, Sports & Ergonomics"
375,"Acute intermittent hypoxia enhances strength, and modulates spatial distribution of muscle activation in persons with chronic incomplete spinal cord injury.","Clinical & Diagnostic, Biomechanics & Kinematics, Rehabilitation & Therapy, Neurophysiology"
376,Characterizing the Dynamics of Surface Electromyography Signals in Muscle Fatigue Through Visibility Motif Networks,"Clinical & Diagnostic, Rehabilitation & Therapy, Sports & Ergonomics"
377,An Exosuit System With Bidirectional Hand Support for Bilateral Assistance Based on Dynamic Gesture Recognition,"Clinical & Diagnostic, Biomechanics & Kinematics, Rehabilitation & Therapy, HCI & Prosthetics"
378,A Novel Exoskeleton Neuromuscular Interface Based on Motor Unit Action Potential Model Using High-Density sEMG,"Biomechanics & Kinematics, HCI & Prosthetics, Neurophysiology, Sports & Ergonomics"
379,Graph-Driven Simultaneous and Proportional Estimation of Wrist Angle and Grasp Force via High-Density EMG,"Biomechanics & Kinematics, HCI & Prosthetics"
380,Comparative electromyography analysis of subphase gait disorder in chronic stroke survivors.,"Clinical & Diagnostic, Biomechanics & Kinematics, Rehabilitation & Therapy, HCI & Prosthetics"
381,Finger Tracking Using Wrist-Worn EMG Sensors,HCI & Prosthetics
382,Tongue brushing enhances the myoelectric activity of the suprahyoid muscles in older adults: a six-week randomized controlled trial.,"Rehabilitation & Therapy, HCI & Prosthetics"
384,Comparative analysis of myoelectric activity and mandibular movement in healthy and nonpainful articular temporomandibular disorder subjects.,"Clinical & Diagnostic, Biomechanics & Kinematics, HCI & Prosthetics, Sports & Ergonomics"
385,Accurate Identification of Motoneuron Discharges From Ultrasound Images Across the Full Muscle Cross-Section,"HCI & Prosthetics, Neurophysiology"
386,A Cross-Subject sEMG-to-Speech Conversion System Using Content Features and Model Calibration,"Clinical & Diagnostic, Rehabilitation & Therapy"
387,Comparative Analysis of SCM Muscle Fatigue in Office Workers with Hunched Posture: A Study on Chronic Lower Back Pain versus Non-Affected Individuals.,"Clinical & Diagnostic, Biomechanics & Kinematics, Rehabilitation & Therapy, HCI & Prosthetics, Sports & Ergonomics"
388,Koopman-Driven Grip Force Prediction Through EMG Sensing,"Biomechanics & Kinematics, Rehabilitation & Therapy, HCI & Prosthetics"
389,Design and Validation of a Novel Human–Machine Interface System Based on Multisource Data Fusion,"HCI & Prosthetics, Sports & Ergonomics"
390,Acute cross-education effect on force production and central/peripheral responses to unilateral eccentric and concentric resistance exercise in elbow flexors.,"Biomechanics & Kinematics, Rehabilitation & Therapy, HCI & Prosthetics, Neurophysiology"
392,sEMG-Based Joint Angle Estimation via Hierarchical Spiking Attentional Feature Decomposition Network,"Biomechanics & Kinematics, Rehabilitation & Therapy, HCI & Prosthetics, Neurophysiology"
393,Investigating the Impact of Training Protocols on Myoelectric Pattern Recognition Control in Upper-Limb Amputees,"Biomechanics & Kinematics, Rehabilitation & Therapy, HCI & Prosthetics, Sports & Ergonomics"
394,Reconstructing Unseen Sentences From Speech-Related Biosignals for Open-Vocabulary Neural Communication,"Clinical & Diagnostic, Rehabilitation & Therapy, Neurophysiology"
395,Neck EMG-Based Estimation of Upper-Limb Muscle Tension,"Biomechanics & Kinematics, Sports & Ergonomics"
396,Estimated moments at L5/S1 level and muscular activation of back extensors for six prone back extension exercises in healthy individuals.,"Clinical & Diagnostic, Biomechanics & Kinematics, Rehabilitation & Therapy, Sports & Ergonomics"
397,"Using risk factors, myoelectric signal, and finger tremor to distinguish computer users with and without musculoskeletal symptoms.","Clinical & Diagnostic, Biomechanics & Kinematics, HCI & Prosthetics, Sports & Ergonomics"
398,Gluteus minimus: an intramuscular EMG investigation of anterior and posterior segments during gait.,Biomechanics & Kinematics
399,Hand and Wrist Movement Control of Myoelectric Prosthesis Based on Synergy,"Biomechanics & Kinematics, HCI & Prosthetics, Neurophysiology"
400,Development of an EMG-ACC-Based Upper Limb Rehabilitation Training System.,"Clinical & Diagnostic, Rehabilitation & Therapy, HCI & Prosthetics, Sports & Ergonomics"
