ID,Title,Abstract,Year,Database,Journal,Screening_Reason,Sample_Size,Gender_Details,Age_Details,Race_Ethnicity_Details,Country_of_Study,Extraction_Notes,Assigned_Categories,Pediatrics (<=18),Young Adult (19-35),Middle-aged (36-60),Senior/Elderly (>60),Not Reported,Age Diversity Index
203,Innate Muscle Patterns Reproduction During Afferent Somatosensory Input With Vojta Therapy in Healthy Adults. A Randomized Controlled Trial,"Objective: Vojta therapy describes stereotypic widespread motor responses as a pattern of tonic muscle contractions during a peripherical pressure stimulation. The present work proposes to characterize the responses at muscles level to a specific tactile input based on Vojta therapy, assessed by sEMG, compared to a sham stimulation in healthy subjects. Methods: Surface electromyography (sEMG) signal was acquired with dipolar electrodes placed at wrist extensors of both forearms, right tibialis anterior, and top part of rectus abdominus, ground channel placed over the right olecranon. It was amplified and digitized by a 4-channel hub Biosignalsplux device (Plux Wireless Biosignals S.A., Lisboa, Portugal), sampled at 1000 Hz with 16-bit per channel. A continuous 10-minute record of the sEMG signal from the four electrodes were registered. Resting EEG during the first minute before the stimulation period was recorded by 64 active electrodes. Results: Statistically significant differences were showed between sham and experimental group. Experimental group participants were subjected to cluster analysis based on their muscle activation patterns, generating three different models of activation. Differences in the previous resting cortical activity in left superior frontal area were found between clusters that activated limb muscles and the cluster that did not. Conclusions: Vojta specific stimulation area activates innate muscle responses assessed by sEMG in healthy subjects, compared to a sham stimulation. Significance: This characterization might be helpful to the prescription and application of Vojta therapy in an individual-basis for non-neurophysiologically damaged adult subjects.",2021,IEEE,IEEE Transactions on Neural Systems and Rehabilitation Engineering,"The study is a randomized controlled trial that uses sEMG as a core modality to collect original data from healthy human adults, published in a peer-reviewed English journal in 2021.",40,16 male and 24 female,"Mean 30.3 ± 7.3 years, range 18-50 years",Not reported,Spain,"The sample size, gender, and age details were found in the 'Participants' subsection of the Methods and the 'Sociodemographic Data' subsection of the Results, as well as in Table I.","Rehabilitation & Therapy, Neurophysiology, Sports & Ergonomics",1,1,1,0,0,32
204,Single-institutional reference values for concentric needle jitter analysis using the extrapolated reference values procedure: Comparison to published reference values.,"BACKGROUND: The extrapolated reference values procedure (E-Ref) was used to compare data from a single institution with the recently published reference value (RV) for concentric electrode jitter. METHODS: Data from voluntarily activated concentric needle jitter studies in the frontalis muscle were obtained using retrospective chart review. All measured signals were reviewed for acceptable quality. Cutoff values for increased jitter were calculated using E-Ref, and compared with the published RVs. RESULTS: At total of 1501 apparent single-fiber action potential (ASFAP) pairs were reviewed; 1371 ASFAP pairs were determined to have acceptable quality. The cutoff value identified by E-Ref from all reviewed ASFAP pairs was 36??microseconds and the cutoff for acceptable pairs was 35??microseconds. Using either of these cutoff values (36??or 35??microseconds) did not result in a significant difference in percentage of jitter recordings considered normal when compared with the recently published RV (38??microseconds). DISCUSSION: The single-institution jitter cutoff value obtained by E-Ref gives results that are not significantly different from the reported RV.",2021,PubMed,Muscle &amp; Nerve,The paper is a primary empirical study from 2021 analyzing original concentric needle EMG data collected from human participants as its core methodology.,77,53 (69%) were women,"Mean 57 (standard deviation [SD], 16.1) years",Not reported,USA,Participant demographic data was located in the first paragraph of the 'RESULTS' section. The country of study was determined from the institutional affiliation mentioned in the 'METHODS' section.,Neurophysiology,0,0,1,1,0,32.2
205,Electromyographic Assessment of the Efficacy of Deep Dry Needling versus the Ischemic Compression Technique in Gastrocnemius of Medium-Distance Triathletes.,"Several studies have shown that gastrocnemius is frequently injured in triathletes. The causes of these injuries are similar to those that cause the appearance of the myofascial pain syndrome (MPS). The ischemic compression technique (ICT) and deep dry needling (DDN) are considered two of the main MPS treatment methods in latent myofascial trigger points (MTrPs). In this study superficial electromyographic (EMG) activity in lateral and medial gastrocnemius of triathletes with latent MTrPs was measured before and immediately after either DDN or ICT treatment. Taking into account superficial EMG activity of lateral and medial gastrocnemius, the immediate effectiveness in latent MTrPs of both DDN and ICT was compared. A total of 34 triathletes was randomly divided in two groups. The first and second groups (n = 17 in each group) underwent only one session of DDN and ICT, respectively. EMG measurement of gastrocnemius was assessed before and immediately after treatment. Statistically significant differences (p = 0.037) were shown for a reduction of superficial EMG measurements differences (%) of the experimental group (DDN) with respect to the intervention group (ICT) at a speed of 1 m/s immediately after both interventions, although not at speeds of 1.5 m/s or 2.5 m/s. A statistically significant linear regression prediction model was shown for EMG outcome measurement differences at V1 (speed of 1 m/s) which was only predicted for the treatment group (R(2) = 0.129; ?? = 8.054; F = 4.734; p = 0.037) showing a reduction of this difference under DDN treatment. DDN administration requires experience and excellent anatomical knowledge. According to our findings immediately after treatment of latent MTrPs, DDN could be advisable for triathletes who train at a speed lower than 1 m/s, while ICT could be a more advisable technique than DDN for training or competitions at speeds greater than 1.5 m/s.",2021,PubMed,Sensors,The paper is a primary empirical study from 2021 that uses surface EMG as a core outcome measure to compare two treatments in human participants.,34,20 males and 14 females,Experimental group (n=17): 35.29 ± 5.39 years; Intervention group (n=17): 33.76 ± 5.76 years. The age inclusion criteria was >18 and <75 years.,Not reported,Spain,"Demographic data was located in the 'Results' section, specifically under subsection '3.1. Sociodemographic Characteristic by Treatment Groups' and in Table 1. Total participant count and gender breakdown were also stated at the beginning of the 'Results' section.","Clinical & Diagnostic, Rehabilitation & Therapy, HCI & Prosthetics",1,1,1,1,0,57
206,Electromyographic comparison of vastus medialis obliquus facilitatory versus vastus lateralis inhibitory kinesio taping in athletes with patellofemoral pain: A randomized clinical trial.,"BACKGROUND: Patellofemoral pain (PFP) is among the most common orthopedic complications afflicting active young people. Diminished coordination of the vastii, delayed activation of the vastus medialis obliquus (VMO), and decreased VMO-to-vastus lateralis (VL) activity ratio are well documented as underlying causes of PFP. This study compares the effects of VMO facilitatory kinesio tape (KT) versus VL inhibitory KT on electromyographic (EMG) activity of the vastii, balance, and pain in athletes with PFP. METHODS: In this single-blind randomized clinical trial, thirty-two female athletes with PFP (mean age 26.33??????5.93 years) were randomly assigned to VMO facilitatory KT (n??=??16) or VL inhibitory KT (n??=??16) groups. In the facilitatory group, a Y-shaped strip of KT at 25% of its available tension was attached from the origin of the VMO to its insertion and in the inhibitory group, an insertion-to-origin Y-shaped strip of KT at 15% of its available tension was applied on the VL. Pain intensity, dynamic balance, and EMG data were assessed respectively with a visual analogue scale, the modified Star Excursion Balance Test, and an EMG telemetry system, before and immediately after KT application. RESULTS: Pain intensity decreased and dynamic balance improved significantly after taping in both groups, and VMO: VL activity ratio increased significantly in the VL group. However, none of the parameters differed significantly between groups. CONCLUSIONS: Both VMO facilitatory and VL inhibitory KT can improve pain and balance, while the inhibitory technique might be more effective in regulating the VMO to VL activity ratio in athletes with PFP.",2021,PubMed,Journal of Bodywork and Movement Therapies,"The paper is a randomized clinical trial from 2021 that collects and analyzes original surface EMG data as a core outcome measure in human participants, meeting all inclusion criteria.",32,32 female athletes,"Mean 26.33 ± 5.93 years, range 18-40 years",Not reported,Iran,"Participant demographic information such as sample size, gender, and age details were located in the abstract and the 'Methods' section under 'Participants'. Race and ethnicity were not reported in the text.","Clinical & Diagnostic, Biomechanics & Kinematics",1,1,1,0,0,22
207,Sensing and decoding the neural drive to paralyzed muscles during attempted movements of a person with tetraplegia using a sleeve array.,"Motor neurons convey information about motor intent that can be extracted and interpreted to control assistive devices. However, most methods for measuring the firing activity of single neurons rely on implanted microelectrodes. Although intracortical brain-computer interfaces (BCIs) have been shown to be safe and effective, the requirement for surgery poses a barrier to widespread use that can be mitigated by instead using noninvasive interfaces. The objective of this study was to evaluate the feasibility of deriving motor control signals from a wearable sensor that can detect residual motor unit activity in paralyzed muscles after chronic cervical spinal cord injury (SCI). Despite generating no observable hand movement, volitional recruitment of motor units below the level of injury was observed across attempted movements of individual fingers and overt wrist and elbow movements. Subgroups of motor units were coactive during flexion or extension phases of the task. Single digit movement intentions were classified offline from the electromyogram (EMG) power [root-mean-square (RMS)] or motor unit firing rates with median classification accuracies >75% in both cases. Simulated online control of a virtual hand was performed with a binary classifier to test feasibility of real-time extraction and decoding of motor units. The online decomposition algorithm extracted motor units in 1.2 ms, and the firing rates predicted the correct digit motion 88??????24% of the time. This study provides the first demonstration of a wearable interface for recording and decoding firing rates of motor units below the level of injury in a person with motor complete SCI.NEW & NOTEWORTHY A wearable electrode array and machine learning methods were used to record and decode myoelectric signals and motor unit firing in paralyzed muscles of a person with motor complete tetraplegia. The myoelectric activity and motor unit firing rates were task specific, even in the absence of visible motion, enabling accurate classification of attempted single-digit movements. This wearable system has the potential to enable people with tetraplegia to control assistive devices through movement intent.",2021,PubMed,Journal of Neurophysiology,The study is a primary empirical research article from 2021 that uses a high-density surface EMG array as a core modality to collect original data from a human participant.,1,1 Male,32 years old,Not reported,USA,"Participant demographic details were found in the 'MATERIALS AND METHODS' section, under the 'Participant' subsection. The study involved a single 32-year-old male participant, but did not report their race or ethnicity.","Clinical & Diagnostic, Biomechanics & Kinematics, Rehabilitation & Therapy, HCI & Prosthetics, Neurophysiology",0,1,0,0,0,0
208,Non-Invasive Analysis of Motor Unit Activation During Simultaneous and Continuous Wrist Movements,"Surface electromyography (EMG) signals have shown promising applications in human-machine interfacing (HMI) systems such as orthotics, prosthetics, and exoskeletons. Nevertheless, existing myoelectric control methods, generally based on time-domain or frequency-domain features, could not directly interpret neural commands. EMG decomposition techniques have become a prevailing solution to decode the motor neuron discharges from the spinal cord, whereas only single degree-of-freedom (DoF) movements are primarily involved in the current neural-based interfaces, resulting in limited intuitiveness and functionality. Here, we propose a non-invasive framework to analyze motor unit activities and estimate wrist torques during simultaneous contractions of multiple DoFs. Motor unit discharges were decoded from surface EMG signals and pooled into groups during sequential wrist movements. Then three neural features were extracted and linearly projected to the torques of multi-DoF tasks. On average, there were 44$\pm$13 motor units identified for each motion with a PNR value of 25.8$\pm$2.9 dB. The neural features outperformed the classic EMG feature on the estimation accuracy with higher correlation coefficients and smoothness. These results demonstrate the feasibility and superiority of the proposed framework in kinetics estimation of simultaneous movements, extending the potential applications of surface EMG decomposition in human-machine interfaces.",2022,IEEE,IEEE Journal of Biomedical and Health Informatics,"The study is primary empirical research that collects original high-density surface EMG data from human participants to analyze wrist movements, meeting all inclusion criteria.",12,"9 males, 3 females",Range 24-34 years,Not reported,China,"Participant demographics were located in Section II. METHODS, under the subheading A. Experiments, 1) Participants. The country of study was identified from the author affiliations and the local ethics committee approval.","Biomechanics & Kinematics, Rehabilitation & Therapy, HCI & Prosthetics, Neurophysiology",0,1,0,0,0,10
209,Unknown Motion Rejection in Myoelectric Pattern Recognition Using Convolutional Prototype Network,"Traditional myoelectric pattern recognition (MPR) systems usually perform well under laboratory conditions. However, in practice, unknown motions that do not appear in the training phase will inevitably disturb MPR systems, leading to dramatic performance degradation in motion classification. Generative and discriminative models are two representative ways to solve this problem in the literature. They only learn the patterns of known motions and reject unknown motion samples endowed with different patterns. However, the generative models often perform poorly in categorizing known motions compared with the discriminative models. While in contrast, the discriminative models always perform relatively inferiorly in distinguishing unknown motions. In this paper, a novel myoelectric control method based on the convolutional prototype network (CPN) is proposed. CPN combines the advantage of the generative model and the discriminative model in an end-to-end manner. It constructs multiple prototypes of known motion classes and identifies samples of known/unknown classes using the template (i.e., prototype) matching. The proposed method is evaluated using the high-density surface electromyography (HD-sEMG) data recorded while performing seven known and six unknown hand motions. Compared to the latest deep learning-based study, our proposed method can yield a significantly higher accuracy of 97.87% in identifying unknown motions and reduce training and testing time by more than 80%, indicating that it is a promising solution to realize robust myoelectric control in practice.",2022,IEEE,IEEE Sensors Journal,"The study is primary empirical research that collected original high-density sEMG data from human participants to develop a myoelectric pattern recognition method, meeting all inclusion criteria.",9,"six males, three females",25.33 ± 1.56 years old,Not reported,China,"Demographic information was found in Section III (Experiments and Results), Part A (Experiments Setup), subsection 1 (Subjects). The author affiliations and ethics board approval also indicate the study was conducted in China.","Rehabilitation & Therapy, HCI & Prosthetics, Sports & Ergonomics",0,1,0,0,0,3.12
210,The Influence of Training With Visual Biofeedback on the Predictability of Myoelectric Control Usability,"Studies have shown that closed-loop myoelectric control schemes can lead to changes in user performance and behavior compared to open-loop systems. When users are placed within the control loop, such as during real-time use, they must correct for errors made by the controller and learn what behavior is necessary to produce desired outcomes. Augmented feedback, consequently, has been used to incorporate the user throughout the training process and to facilitate learning. This work explores the effect of visual feedback presented during user training on both the performance and predictability of a myoelectric classification-based control system. Our results suggest that properly designed feedback mechanisms and training tasks can influence the quality of the training data and the ability to predict usability using linear combinations of metrics derived from feature space. Furthermore, our results confirm that the most common in-lab training protocol, screen guided training, may yield training data that are less representative of online use than training protocols that incorporate the user in the loop. These results suggest that training protocols should be designed that better parallel the testing environment to more effectively prepare both the algorithms and users for real-time control.",2022,IEEE,IEEE Transactions on Neural Systems and Rehabilitation Engineering,"The study is original empirical research from 2022 that uses EMG as a core modality to investigate myoelectric control usability in human participants, meeting all inclusion criteria.",12,9 male/3 female,"Mean 33 ± 15.2 yrs, range 22-63 yrs.",Not reported,Canada,"All demographic information was found in the 'II. METHODS' section, under the subsection 'A. Participants'.","Rehabilitation & Therapy, HCI & Prosthetics, Sports & Ergonomics",0,1,1,1,0,41
211,Effect of Core Stability Training on Correction and Surface Electronic Signals of Paravertebral in Adolescent Idiopathic Scoliosis.,"OBJECTIVE: To observe the effect of 12-week core stability training on Cobb angle and the ratios of AEMG (averaged EMG) and IEMG (integral EMG) of paravertebral electromyography in thoracic and lumbar segments in adolescent idiopathic scoliosis (AIS) patients and offer a practical-based evidence for the rehabilitation treatment for AIS patients. METHODS: 31 AIS female middle school students were randomly divided into an exercise group (n = 16, 12 weeks of core stability training, 3 times/week) and AIS group (n = 15). In addition, 15 female secondary school students without scoliosis were included as the normal group (the AIS group and normal group did not perform any regular physical exercise throughout the trial period and only receive regular evaluation and guidance). Before and after the experiment, the digital diagnostic equipment of Philips was used to examine the Cobb angle and Noraxon was used to measure the surface EMG signals of the back thoracic and lumbar paravertebral muscles. RESULTS: Compared with that before training, after 12 weeks of core stability training, the Cobb angle in the exercise group significantly decreased, and the ratio of AEMG (convex/concave) and IEMG (convex/concave) of paravertebral muscles in the thoracolumbar segment significantly decreased (P < 0.01, respectively); there was no significant difference in the above indicators in the AIS group before and after the experiment (P > 0.05, respectively). After 12 weeks of core stability training, compared with the AIS group, the Cobb angle decreased significantly (P < 0.01), and the ratio of AEMG (convex/concave) and IEMG (convex/concave) of paravertebral muscles in thoracolumbar segment decreased significantly (P < 0.01, P < 0.05). Compared with the normal group, the ratio of AEMG and IEMG of paravertebral muscles in thoracolumbar segment significantly increased (P < 0.01) in the AIS group (P < 0.01, respectively). CONCLUSIONS: The core stability training can significantly reduce the Cobb angle of AIS and correct the bad posture of scoliosis patients, which may be related to the balance of the electromyographic activities (convex concave side) of paravertebral muscles in AIS patients.",2022,PubMed,BioMed Research International,"The study is a randomized clinical trial from 2022 that collects original surface EMG data from human participants as a core outcome measure, meeting all inclusion criteria.",57,"10 Males, 47 Females","Mean 38.2 ± 10.4 years, range 22-64",Not reported,Finland,"The demographic data, including sample size, gender, and age, was primarily found in the 'Patients' subsection (2.1) of the Results section and detailed in Table 1, 'Patient sociodemographic characteristics'.","Clinical & Diagnostic, Biomechanics & Kinematics, Rehabilitation & Therapy",0,1,1,1,0,42
212,Double-Differential Amplifier for sEMG Measurement by Means of a Current-Mode Approach,"This work proposes a Double Differential (DD) amplifier topology which exploits the advantages of the current-mode approach. DD amplifiers are useful as front-ends in standalone active electrodes for superficial electromyography (sEMG) wearable applications and electroneurography (ENG) measurement devices. Front-ends for these applications need to attain low noise, high common-mode rejection ratio, and high input impedance to measure biopotential signals and can further benefit from low power operation, a small size, and an easily adaptable output. Presently published DD amplifiers are either complex in terms of a high part count, leading to higher power consumption and size, or suffer from limited interference-rejection capabilities and require further analog processing for compatibility with single-ended systems. Therefore, in this work, second-generation current conveyors have been leveraged to obtain a simple topology combining a small active-part count, a high common-mode rejection ratio, and a flexible output stage. The current-mode DD amplifier is presented and analyzed in detail to estimate its parameters and model the effects of nonidealities in the circuit. In order to validate the proposed topology, a discrete-component implementation was realized as a proof-of-concept. The results experimentally demonstrated the properties of the proposed topology and its feasibility for measuring superficial sEMG DD signals.",2022,IEEE,IEEE Access,"The paper presents primary empirical research on a novel sEMG amplifier, validated with original in-vivo data collected from human participants in 2022.",1,Not reported,Not reported,Not reported,Argentina,"Participant demographics are not reported in the paper. The country of study was identified from the 'In-vivo DD EMG Validation' section, which states that measurements followed a research plan approved by the La Plata National University bioethics committee in Argentina.","HCI & Prosthetics, Sports & Ergonomics",0,0,0,0,1,N/A
