ID,Title,Abstract,Year,Database,Journal,Screening_Reason,Sample_Size,Gender_Details,Age_Details,Race_Ethnicity_Details,Country_of_Study,Extraction_Notes,Assigned_Categories,Pediatrics (<=18),Young Adult (19-35),Middle-aged (36-60),Senior/Elderly (>60),Not Reported,Age Diversity Index
304,Influence of priming exercise on muscle deoxy[Hb + Mb] during ramp cycle exercise.,"The aim of the present study was to gain better insight into the mechanisms underpinning the sigmoid pattern of deoxy[Hb + Mb] during incremental exercise by assessing the changes in the profile following prior high-intensity exercise. Ten physically active students performed two incremental ramp (25 W min(-1)) exercises (AL and LL, respectively) preceded on one occasion by incremental arm (10 W min(-1)) and on another occasion by incremental leg exercise (25 W min(-1)), which served as the reference test (RT). Deoxy[Hb + Mb] was measured by means of near-infrared spectroscopy and surface EMG was recorded at the Vastus Lateralis throughout the exercises. Deoxy[Hb + Mb], integrated EMG and Median Power Frequency (MdPF) were expressed as a function of work rate (W) and compared between the exercises. During RT and AL deoxy[Hb + Mb] followed a sigmoid increase as a function of work rate. However, during LL deoxy[Hb + Mb] increased immediately from the onset of the ramp exercise and thus no longer followed a sigmoid pattern. This different pattern in deoxy[Hb + Mb] was accompanied by a steeper slope of the iEMG/W-relationship below the GET (LL: 0.89 ± 0.11% W(-1); RT: 0.74 ± 0.08% W(-1); AL: 0.72 ± 0.10% W(-1)) and a more pronounced decrease in MdPF in LL (17.2 ± 4.5%) compared to RT (5.0 ± 2.1%) and AL (3.9 ± 3.2%). It was observed that the sigmoid pattern of deoxy[Hb + Mb] was disturbed when the ramp exercise was preceded by priming leg exercise. Since the differences in deoxy[Hb + Mb] were accompanied by differences in EMG it can be suggested that muscle fibre recruitment is an important underlying mechanism for the pattern of deoxy[Hb + Mb] during ramp exercise.",2012,PubMed,European journal of applied physiology,The study is original empirical research from 2012 involving human participants and utilizes surface EMG as a core data collection modality to investigate muscle recruitment.,10,ten male,mean ± SD age 22 ± 2 years,Not reported,Belgium,"Participant demographic information was located in the 'Methods' section, under the 'Subjects' subsection. This section specified the sample size, gender, and mean age with standard deviation.","Rehabilitation & Therapy, Neurophysiology, Sports & Ergonomics",0,1,0,0,0,4
305,Task-dependent changes of motor cortical network excitability during precision grip compared to isolated finger contraction.,"The purpose of this study was to determine whether task-dependent differences in corticospinal pathway excitability occur in going from isolated contractions of the index finger to its coordinated activity with the thumb. Focal transcranial magnetic stimulation (TMS) was used to measure input-output (I/O) curves--a measure of corticospinal pathway excitability--of the contralateral first dorsal interosseus (FDI) muscle in 21 healthy subjects performing two isometric motor tasks: index abduction and precision grip. The level of FDI electromyographic (EMG) activity was kept constant across tasks. The amplitude of the FDI motor evoked potentials (MEPs) and the duration of FDI silent period (SP) were plotted against TMS stimulus intensity and fitted, respectively, to a Boltzmann sigmoidal function. The plateau level of the FDI MEP amplitude I/O curve increased by an average of 40% during the precision grip compared with index abduction. Likewise, the steepness of the curve, as measured by the value of the maximum slope, increased by nearly 70%. By contrast, all I/O curve parameters [plateau, stimulus intensity required to obtain 50% of maximum response (S(50)), and slope] of SP duration were similar between the two tasks. Short- and long-latency intracortical inhibitions (SICI and LICI, respectively) were also measured in each task. Both measures of inhibition decreased during precision grip compared with the isolated contraction. The results demonstrate that the motor cortical circuits controlling index and thumb muscles become functionally coupled when the muscles are used synergistically and this may be due, at least in part, to a decrease of intracortical inhibition and an increase of recurrent excitation.",2012,PubMed,Journal of Neurophysiology,"The study is original empirical research in healthy human participants using surface EMG as a core modality to measure corticospinal excitability, and it meets all other inclusion criteria.",21,"11 men, 10 women","mean ± SD age 35.8 ± 9.4 yr, aged from 20 to 50 yr",Not reported,France,"Participant sample size, gender, and age details were explicitly stated in the 'Ethical approval and subjects' subsection of the 'METHODS' section. Race and ethnicity were not mentioned in the paper.","Biomechanics & Kinematics, Neurophysiology",0,1,1,0,0,30
306,Raised electrical uterine activity and shortened cervical length could predict preterm delivery in a low-risk population.,"PURPOSE: To compare diagnostic accuracy of sonographic cervical length (CL) measurement and uterine electric activity assessed by electromyography (EMG) in second trimester regarding prediction of preterm delivery (PTD). METHODS: Prospective study of 308 low-risk women. Shortened CL was defined as ≤25 mm (≤5th centile), while raised EMG activity was defined as the presence of ≥20 action potentials in 20 min of assessment (≥95th centile). Outcome measures were diagnostic accuracy of both tests alone or in combination for prediction of PTD and early PTD (≤34 weeks). RESULTS: The incidence of PTD was 23/308 (7.4%) while the incidence of early PTD was 9/308 (2.9%). Shortened CL and raised EMG activity were significantly related to PTD [prevalence-weighted likelihood ratio (pw-LR) 1.9, 95% CI 1.0-3.5 vs. 9.5, 95% CI 2.5-35.7], but not to early PTD (pw-LR 0.4, 95% CI 0.2-0.8 vs. 0.6, 95% CI 0.3-1.7). Significant predictive value for early PTD was found only if both tests were combined (pw-LR 4, 95% CI 1.3-14.3). CONCLUSION: Shortened CL and raised EMG activity in second trimester have significant diagnostic accuracy regarding prediction of PTD in a low-risk population. However, in order to be useful as a predictor for early PTD both tests must be positive.",2012,PubMed,Archives of Gynecology and Obstetrics,"This prospective cohort study collected original surface EMG data from human participants as a core modality to predict preterm delivery, meeting all inclusion criteria.",308,308 women,Median maternal age at enrolment was 27 years (interquartile range 24–31),Not reported,Croatia,"Participant demographic data, including sample size, age, and gender, were found in the Abstract and the Results sections. The country of study was identified from the author affiliations and the 'Materials and methods' section.",HCI & Prosthetics,0,1,0,0,0,7
307,Validation of a Selective Ensemble-Based Classification Scheme for Myoelectric Control Using a Three-Dimensional Fitts' Law Test,"When controlling a powered upper limb prosthesis it is important not only to know how to move the device, but also when not to move. A novel approach to pattern recognition control, using a selective multiclass one-versus-one classification scheme has been shown to be capable of rejecting unintended motions. This method was shown to outperform other popular classification schemes when presented with muscle contractions that did not correspond to desired actions. In this work, a 3-D Fitts' Law test is proposed as a suitable alternative to using virtual limb environments for evaluating real-time myoelectric control performance. The test is used to compare the selective approach to a state-of-the-art linear discriminant analysis classification based scheme. The framework is shown to obey Fitts' Law for both control schemes, producing linear regression fittings with high coefficients of determination $(R^{2}>0.936)$. Additional performance metrics focused on quality of control are discussed and incorporated in the evaluation. Using this framework the selective classification based scheme is shown to produce significantly higher efficiency and completion rates, and significantly lower overshoot and stopping distances, with no significant difference in throughput.",2013,IEEE,IEEE Transactions on Neural Systems and Rehabilitation Engineering,"The study is primary empirical research that collected new surface EMG data from healthy human participants to compare myoelectric control schemes, meeting all inclusion criteria.",10,Not reported,ranging in age from 19–52,Not reported,Canada,The number of participants and their age range are stated in the first sentence of the 'II. METHODOLOGY' section. The country of study was inferred from the authors' affiliations and the mention of the University of New Brunswick's Research Ethics Board.,"HCI & Prosthetics, Sports & Ergonomics",0,1,1,0,0,33
308,Stable tooth contacts in intercuspal occlusion makes for utilities of the jaw elevators during maximal voluntary clenching.,"Data are inconsistent concerning whether the level of the surface electromyographic (SEMG) activity of jaw-closing muscles increases when biting forces elevated during maximal voluntary clenching (MVC). In this study, T-Scan III system and BioEMG III system were used to record bite force, occlusal contacts and SEMG activity of the anterior temporalis (TA) and of the masseter muscles (MM) simultaneously. Recordings were obtained from 16 healthy young adult males during different conditions: (i) a fast MVC from resting position to intercuspal position (ICP); (ii) mandibular movements from ICP to protrusive or lateral edge-to-edge positions with teeth in contact with biting; (iii) a fast MVC in protrusive and lateral edge-to-edge positions. A higher level of SEMG activity was associated with a higher bite force during occluding movements (P < 0.05). However, during fast MVC from rest to ICP, the largest number of occlusal contacts was achieved and distributed more symmetrically, the highest level of biting force was obtained, but the SEMG activity of the jaw elevator muscles was reduced compared with its maximum level (P < 0.05). This phenomenon was not observed during the fast MVC in protrusive or lateral edge-to-edge positions. The present results that a lower SEMG activity was associated with the largest number of occlusal contacts and the highest level of bite force during centric MVC demonstrated a complex integration of jaw-closing muscles when a stable occlusion is present.",2013,PubMed,Journal of Oral Rehabilitation,"This is primary empirical research using sEMG as a core data collection modality on human participants, published in a peer-reviewed English journal in 2013.",16,16 Males,Mean 23.1 ± 1.5 years,Not reported,China,"Participant demographic data, including sample size, gender, and age, was located in the first sentence of the 'Subjects' subsection within the 'Materials and methods' section. Race or ethnicity was not reported.","Biomechanics & Kinematics, Sports & Ergonomics",0,1,0,0,0,3
309,Muscle activation and coactivation during five-time-sit-to-stand movement in patients undergoing total knee arthroplasty.,"Quadriceps weakness is prevalent with knee osteoarthritis (OA) and after total knee arthroplasty (TKA). To compensate for quadriceps dysfunction, patients often alter movement strategies. Little is known about muscle coordination during sit-to-stand (concentric) and stand-to-sit (eccentric) movements in the acute postoperative period. This investigation characterized the distribution of muscle activation between the concentric and eccentric phases during a five-time-sit-to-stand (FTSTS) movement in late stage OA and one month after TKA. Patients and healthy participants performed a FTSTS while recording bilateral ground reaction forces (GRFs) and electromyography (EMG). Concentric and eccentric ensemble averages of the GRF and EMG were calculated for the concentric and eccentric phases. Coactivation indices, integrated EMG, and GRF were calculated for each limb and phase. Patients demonstrated higher eccentric coactivation than the healthy group. Postoperative loading was higher in the nonsurgical limb. Postoperative quadriceps activity was lower in the concentric phase and higher in the eccentric phase than the healthy group. Higher coactivation in the patients resulted from sustained distribution of quadriceps activity throughout the eccentric phase. This indicated an inability to coordinate muscle firing when rapidly lowering to a chair and occurred despite unloading of the surgical limb. Although these patterns may serve as a protective strategy, they may also impede recovery of muscle function after TKA.",2013,PubMed,Journal of Electromyography and Kinesiology,"The study is a peer-reviewed, original empirical research article from 2013 that uses surface EMG as a core modality to investigate muscle activation patterns in human participants.",23,"Patient group (n=10): 70.0% Female, 30.0% Male; Healthy group (n=13): 38.4% Female, 61.6% Male",Patient group: Mean 59.7 ± 9.1 years; Healthy group: Mean 63.9 ± 6.8 years,Not reported,United States,Participant numbers for the patient (n=10) and healthy (n=13) groups were found in section 2.1. Detailed age and gender breakdowns for both groups were provided in Table 1.,"Clinical & Diagnostic, Biomechanics & Kinematics, Rehabilitation & Therapy, Neurophysiology",0,0,1,1,0,20.1
310,Treatment efficacy of electromyography versus fiberscopy-guided botulinum toxin injection in adductor spasmodic dysphonia patients: a prospective comparative study.,"INTRODUCTION: This study prospectively evaluates and compares the treatment efficacy of botulinum toxin injection under electromyography guidance (EMG group) and percutaneous botulinum toxin injection under flexible fiberscopic guidance (fiberscopy group). METHODS: Thirty patients with adductor spasmodic dysphonia (ADSD), who had never received treatment, were randomly allocated into EMG- or fiberscopy-guided botulinum toxin injections between March 2008 and February 2010. We assessed acoustic and aerodynamic voice parameters, and the voice handicap index (VHI) before injection and at 1, 3, and 6 months after injection. RESULTS: The mean total dosage of botulinum toxin was similar for both groups: 1.7 ± 0.5 U for the EMG group and 1.8 ± 0.4 U for the fiberscopy group (P > 0.05). There were no significant differences in outcomes between the two groups in either the duration of effectiveness or complications such as breathy voice and aspiration. CONCLUSION: Botulinum toxin injection under fiberscopic guidance is a viable alternative to EMG-guided botulinum toxin injection for the treatment of adductor spasmodic dysphonia when EMG equipment is unavailable.",2014,PubMed,The Scientific World Journal,"The paper is a prospective comparative study with original data from human participants, published in English in 2014, and uses EMG as a core modality for comparison, thus meeting all inclusion criteria.",30,Not reported,"Mean ages: 34.9 ± 14.9 years (EMG group, n=15) and 31.9 ± 9.7 years (fiberscopy group, n=15)",Not reported,Republic of Korea,"Participant numbers and study location were found in the 'Materials and Methods' section. Age details were provided for each subgroup in Table 1, but gender and ethnicity were not reported.",Clinical & Diagnostic,0,1,1,0,0,29.8
311,"The effects of Kinesio taping on muscle tone in healthy subjects: a double-blind, placebo-controlled crossover trial.","Kinesio taping (KT) has been proposed to modulate muscle tone. However no studies have systematically studied the efficacy of KTon this primary outcome measure. The objective of this study was to determine the effect of Kinesio taping (KT) applied over the gastrocnemius muscles on muscle tone, extensibility, electromyography (EMG) and strength. Nineteen healthy subjects were enrolled in a double-blind, placebo controlled crossover trial. KT and sham-tape were applied onto the gastrocnemius muscles of all subjects in two randomized sessions. Measurements before, at 10 min and 24 h after the intervention were taken. Outcome measurements included passive resistive torque to ankle dorsiflexion, dorsiflexion passive range of motion (PROM), surface Gastrocnemius Medialis (GM) EMG and maximal isometric voluntary force (MIVF). No significant differences were found between the sham-tape and KT groups for passive resistive torque, PROM nor maximal plantarflexion isometric voluntary force. A short-term increase of GM EMG activity was found in the KT group during the PROM mobilization, which was not maintained at 24 h following treatment. A short-term decrease in dorsiflexion force was produced 10 min after KT with respect to sham-tape application. These results demonstrate that the application of KT in the gastrocnemius muscles has no effect on healthy muscle tone, extensibility nor strength. However a short-term increase of GM EMG activity after KT treatment suggests the activation of central nervous system mechanisms, although without a therapeutic implication. Further studies with more appropriate designs are needed to clarify the physiological and therapeutic effects of this taping technique.",2014,PubMed,Manual therapy,"The paper is a primary empirical study with original data from healthy human subjects, published in English in 2014, and uses surface EMG as a core outcome measure.",19,8 males and 11 females,mean age of 23.8 ± 3.9 years (accepted range 18-40),Not reported,Spain,All participant demographic information was found in the '2.1. Subjects' section of the Methods. The paper did not report on the race or ethnicity of the participants.,"Biomechanics & Kinematics, Rehabilitation & Therapy, Neurophysiology",1,1,1,0,0,22
312,A preliminary evaluation of the surgery to reconstruct thoracic breathing in patients with high cervical spinal cord injury.,"STUDY DESIGN: A prospective study. OBJECTIVES: To evaluate the effect of the surgery to reconstruct thoracic breathing in patients with high cervical spinal cord injury (CSCI). SETTING: China Rehabilitation Research Center, Beijing, China. METHODS: The posterior ribs (from the fifth to the eighth) were suspended on the inferior angle of the scapula on each side using titanium cables, as well as muscles and myofascial tissue in the subscapular area. After the surgery, the patients were trained for synchronous contraction of the trapezius and diaphragm muscles, and electromyography (EMG) was performed to evaluate the synchronization. The clinical symptoms and pulmonary function were assessed within 1 week before surgery and at 2, 12 and 24 postoperative weeks. RESULTS: Six patients with complete high CSCI received rib suspension surgery 84±26.7 days after spinal cord injury. Before the surgery, all of the patients presented with weakened cough, retention of respiratory secretions and dyspnea, while these symptoms alleviated postoperatively. The vital capacity (VC) was enhanced to be 1680±282 ml at 2 weeks after the surgery, compared with 1085±92 ml (P=0.013). The EMG showed a synchronous muscle electrical activity between the trapezius muscles and diaphragm during deep breaths. CONCLUSION: The rib suspension surgery partially restored the thoracic breathing of the patients with high CSCI, thereby improving VC, cough and expectoration.",2014,PubMed,Spinal Cord,"The study is original empirical research in humans, published in English in 2014, and uses surface EMG as a core modality to evaluate muscle synchronization after surgery.",6,"4 Males, 2 Females","Mean 41.7 ± 16.2 years, range 18-60 years",Not reported,China,"Participant demographic data, including sample size, age, and sex, were extracted from the 'Results' section and Table 2. Race and ethnicity were not reported in the paper.","Clinical & Diagnostic, Biomechanics & Kinematics, Rehabilitation & Therapy",1,1,1,0,0,42
313,Chin tuck against resistance (CTAR): new method for enhancing suprahyoid muscle activity using a Shaker-type exercise.,"For patients with dysphagia resulting from upper esophageal sphincter dysfunction, strengthening the suprahyoid muscles through therapeutic exercise has proved effective in restoring oral feeding. The aim of this study was to compare the maximum and mean surface electromyography (sEMG) activity of the suprahyoid muscles during the Chin Tuck Against Resistance (CTAR) exercise and the Shaker exercise for both isokinetic and isometric tasks. During the CTAR exercises, the participant is seated while tucking the chin to compress an inflatable rubber ball, whereas during the Shaker exercise, the participant is lay supine while lifting the head to look at the feet. Forty healthy participants (20 males, 20 females) aged 21-39 years completed all four tasks in counterbalanced order, with measures of resting activation taken prior to each exercise. Although subjective feedback suggested that the sitting position for CTAR is less strenuous than the supine position for Shaker, the results of separate analyses showed significantly greater maximum sEMG values during the CTAR isokinetic and isometric exercises than during the equivalent Shaker exercises, and significantly greater mean sEMG values were observed for the CTAR isometric exercise than for the Shaker isometric exercise. Clinical trials are now needed, but the CTAR exercises appear effective in exercising the suprahyoid muscles, and they could achieve therapeutic effects comparable to those of Shaker exercises, with the potential for greater compliance by patients.",2014,PubMed,Dysphagia,"The study is original empirical research using sEMG as a core outcome measure to compare two exercises in healthy human participants, published in English in 2014.",40,20 males and 20 females,"Mean 29.13 ± 5.694 years, range 21-39",Not reported,Singapore,"Participant demographics including sample size, gender, and age were found in the 'Participants' subsection of the 'Materials and Methods' section. Race or ethnicity was not reported.","Clinical & Diagnostic, Biomechanics & Kinematics, Rehabilitation & Therapy",0,1,1,0,0,18
314,EMG of the tibialis anterior demonstrates a training effect after utilization of a foot drop stimulator.,"BACKGROUND: Functional Electrical Stimulation (FES) applied through a foot drop stimulator (FDS) is a rehabilitation intervention that can stimulate the common peroneal nerve to provide dorsiflexion at the correct timing during gait. OBJECTIVE: To determine if FES applied to the peroneal nerve during walking through a FDS would effectively retrain the electromyographic temporal activation of the tibialis anterior in individuals with stroke. METHODS: Surface electromyography (EMG) were collected bilaterally from the tibialis anterior (TA) while participants (n = 4) walked with and without the FDS at baseline and 4 weeks. Comparisons were made between stimulation timing and EMG activation timing to produce a burst duration similarity index (BDSI). RESULTS: At baseline, participants displayed variable temporal activation of the TA. At 4 weeks, TA activation during walking without the FDS more closely resembled the pre-programmed FDS timing demonstrated by an increase in BDSI scores in all participants (P = 0.05). CONCLUSIONS: Continuous use of FDS during a task specific movement can re-train the neuromuscular system. After 4 weeks of utilization the FDS trained the TA to replicate the programmed temporal activation patterns. These findings begin to establish the FDS as a rehabilitation intervention that may facilitate recovery rather than just compensate for stroke related gait impairments due to foot drop.",2014,PubMed,"NeuroRehabilitation: An International, Interdisciplinary Journal","The study is a primary empirical investigation that uses surface EMG as a core modality to assess the effects of a foot drop stimulator in human participants with stroke, published in 2014.",4,"3 male, 1 female",Mean 63.7 ± 8.5 years,Not reported,USA,"Participant demographic information, including sample size, gender, and age, was found in the first paragraph of the '3. Results' section. The country of study was identified from the author affiliations on the first page of the paper.","Biomechanics & Kinematics, Rehabilitation & Therapy, Neurophysiology",0,0,1,1,0,17
