ID,Title,Abstract,Year,Database,Journal,Screening_Reason,Sample_Size,Gender_Details,Age_Details,Race_Ethnicity_Details,Country_of_Study,Extraction_Notes,Assigned_Categories,Pediatrics (<=18),Young Adult (19-35),Middle-aged (36-60),Senior/Elderly (>60),Not Reported,Age Diversity Index
105,Differences in time-frequency representation of lower limbs myoelectric activity during single and double leg landing in male athletes.,"This study compared the instantaneous median frequency (IMF) obtained by means of a Choi-Williams transform of an electromyogram of the lower-limb muscles during single-leg (SL) and double-leg (DL) landings performed by fifteen male athletes. The IMF values of the rectus femoris (RF), biceps femoris (BF) and hip adductors (HA) were compared between two landing tasks, within each landing, and before and after ground contact (GC). The IMF values of the RF did not change between landings in contrast to those of the BF, which presented from 20- to 40-ms higher SL values before GC and from 40 to 60 ms after GC. HA presented higher SL values during the 40-60 ms range before GC. Within each landing, the RF IMF decreased from 40 ms to 60 ms after GC in the SL. Similar results were found for the HA IMF, which decreased from 40ms to 80 ms after GC. The BF IMF showed no significant change. These results suggest muscle recruitment related to anterior cruciate ligament protection since the IMF values of the RF decreased in the SL, whereas the BF IMF increased. Results for the HA showed the importance of hip muscles in stabilizing the core region, allowing the activation of distal muscles with greater safety.",2011,PubMed,Journal of Electromyography and Kinesiology,"This is a primary empirical study that collects original surface EMG data from human athletes to compare muscle recruitment during different landing tasks, meeting all inclusion criteria.",15,15 Males,Mean 13 ± 1 year,Not reported,Brazil,"Participant demographic data, including sample size, gender, and age, was explicitly stated in the first sentence of the '2. Materials and methods' section. The country of study was determined from the authors' affiliations.","HCI & Prosthetics, Neurophysiology",1,0,0,0,0,2
106,Effect of meditation on stress-induced changes in cognitive functions.,"OBJECTIVES: The objective of this study was to study the effects of meditation on stress-induced changes in cognitive functions. METHODS: The study was conducted on 32 healthy adult male student volunteers who had never practiced meditation before the study. The study consisted of practicing 20 minutes of guided meditation and administration of psychologic stress to the subjects. The psychologic stress was administered to the subjects by asking them to play a (preselected) stressful computer game. The subjects were asked to meditate either before or after the administration of psychologic stress. For the control group measurements, the subjects were asked to wait quietly for an equivalent period of meditation time. OUTCOME MEASURES: The outcome measures were galvanic skin response (GSR), heart rate (HR), electromyography (EMG), sympathetic reactivity (QTc/QS2 ratio), cortisol, and acute psychologic stress scores. The central nervous system functions were assessed using Wechsler memory scale and visual-choice reaction time (VCRT). These parameters were measured both at the beginning and at the end of the intervention, using a pre-post experimental test design. RESULTS: Computer game stress was associated with a significant increase in physiologic (GSR, EMG, HR, QTc/QS2) and psychologic (acute stress questionnaire scores) markers of stress. Meditation was associated with relaxation (significant decrease in GSR, EMG, QTc/QS2, and acute stress questionnaire scores). Meditation, if practiced before the stressful event, reduced the adverse effects of stress. Memory quotient significantly increased, whereas cortisol level decreased after both stress and meditation. VCRT showed no significant change. CONCLUSIONS: Practice of meditation produced a relaxation response even in the young adult subjects who had never practiced meditation before. The practice of meditation reduced the physiologic stress responses without taking away the beneficial effect of stress, namely, improved memory scores.",2011,PubMed,The Journal of Alternative and Complementary Medicine,The paper is a primary empirical study from 2011 that uses surface EMG as a core outcome measure to assess stress and relaxation in human participants.,32,32 Males,"Mean 27.3 ± 1.8 years, range 23-30 years",Not reported,India,"Participant demographic data, including sample size, gender, and age, were explicitly stated in the first paragraph of the 'Materials and Methods' section. The country of study was identified from the authors' institutional affiliations.","Rehabilitation & Therapy, HCI & Prosthetics, Neurophysiology",0,1,0,0,0,7
107,Effect of breathing 7% carbon dioxide on the human soleus Hoffmann-reflex recruitment curve.,"OBJECTIVE: To examine the effect of inhaling 7% carbon dioxide on the recruitment curve of the soleus H-reflex. METHODS: Five males and five females (apparently healthy; 21-40 yr) with surface EMG electrodes over the soleus muscle randomly breathed room air or a 7% CO???, 21% O???, balance N??? mix for 10 min. The tibial nerve was stimulated to elicit the H-reflex recruitment curve. H-reflex threshold, motor threshold, slope of ascending H-reflex curve, Hmax:Mmax ratio, and latency of Hmax were compared. RESULTS: Breathing 7% carbon dioxide increased the H-reflex threshold (as a percent of motor threshold) from 73% (SD 0.09) to 84% (SD 0.12; p<0.05), decreased the Hmax:Mmax ratio from 0.504 (SD 0.290) to 0.403 (SD 0.253; p<0.05), and increased the H wave latency (in msec) from 32.8 (SD 1.6) to 34.6 (SD 2.6; p<0.05). Slope of ascending H-reflex curve (room air: 125 (SD 89); CO???: 135 (SD 92); p>0.05), Mmax (room air: 3.70 mV (SD 1.57); CO???: 3.69 mV (SD 1.53); p>0.05), and motor threshold (p>0.05) remained unchanged. CONCLUSIONS: Breathing 7% carbon dioxide reduces afferent synaptic transmission in the soleus muscle by slowing transmission, increasing threshold stimulus, and reducing H wave size. SIGNIFICANCE: Clinicians and scientists should consider the possibility that carbon dioxide can reduce afferent synaptic transmission.",2011,PubMed,Medicine &amp; Science in Sports &amp; Exercise,"This is an original empirical study using surface EMG on human participants to investigate the Hoffmann-reflex, which aligns with all inclusion criteria.",10,five males and five females,"Mean 26 (SD 5) years, range: 21–40 years",Not reported,USA,"Participant demographic information was found in the '2.1. Subjects' section. The text specifies the number of participants, gender breakdown, and age details, but does not mention race or ethnicity.",Neurophysiology,0,1,1,0,0,19
109,Passive trunk loading influences muscle activation during dynamic activity.,"INTRODUCTION: Repetitive loading of the low back tissues induces tension relaxation with a corresponding variation in the myoelectric response of the neuromuscular system, which may influence low back health. The purpose of this study was to observe trunk muscle activities before and after a passive cyclic trunk flexion-extension exercise. METHODS: Nineteen participants were subjected to sagittal plane loading of the low back tissues. These individuals performed toe-touching before and over 1 hour after load termination. RESULTS: Lumbar paraspinal activity cessation occurred significantly sooner over time during lumbar and pelvic flexion post-loading, as compared with pre-loading. Lumbar paraspinal activity then re-initiated later in lumbar extension. There was no change in peak or average muscle activity during the procedures. CONCLUSIONS: It is apparent that passive loading of the viscoelastic lumbar tissues results in a prolonged neuromuscular adaptation, followed by possible neuromuscular compensation sustained within 1 hour of load termination.",2011,PubMed,Muscle & nerve,"The study is primary empirical research on human participants, published in English in 2011, and uses surface EMG as a core data collection modality to investigate muscle activation.",19,15 men and 4 women,21.3 ± 0.8 years,Not reported,USA,"Participant demographic information, including sample size, gender breakdown, and age, was found in the 'Subjects' subsection of the 'Methods' section. The country of study was inferred from the author's affiliation.","Biomechanics & Kinematics, Rehabilitation & Therapy, HCI & Prosthetics, Neurophysiology",0,1,0,0,0,1.6
110,Reduced force steadiness in women with neck pain and the effect of short term vibration.,"This study compares neck force steadiness in women with neck pain and controls and the way this is influenced by short term vibration of the neck. In the first experiment, 9 women with chronic neck pain and 9 controls performed 10-s isometric cervical flexion at 15N. Intramuscular EMG was recorded from the sternocleidomastoid muscle. In the second experiment, 10 women with neck pain and 10 controls performed 10-s isometric cervical flexion at 25% of their maximal force before and after vibration to the neck (bursts of 50Hz with duration 20, 40, 60 and 120s). Surface EMG was acquired from the sternocleidomastoid and splenius capitis. In both experiments, force steadiness was characterized by the coefficient of variation (CoV) and the relative power in three frequency subbands (low: 0-3Hz; middle: 4-6Hz; high: 8-12Hz) of the force signal. Women with neck pain exhibited decreased force steadiness (Exp 1: patients 3.9??1.3%, controls 2.7??0.9%, P<0.05; Exp 2: patients 3.4??1.2%, controls 1.7??0.6%, P<0.01) which was associated with higher power in the low-frequency band (patients 71.2??9.6%, controls 56.7??9.2%, P<0.01). Following vibration, CoV (2.6??1.1%, P<0.05) and the power in the low-frequency band of the force signal decreased (63.1??13.9%, P<0.05) in the patient group. These effects were not present in controls. Motor unit behavior and surface EMG amplitude were similar between groups. In conclusion, women with neck pain have reduced force steadiness, likely due to alterations in Ia afferent input. Vibration, which modulates Ia afferent input, increases force steadiness in patients with neck pain.",2011,PubMed,Journal of Electromyography and Kinesiology,"Published in 2011, this article is an English-language peer-reviewed empirical study exploring neck pain and strength stability in women. The core methodology used surface and intramuscular electromyography (EMG) to record data from real human subjects, meeting all inclusion criteria.",38,38 women,Exp 1 patients (n=9): 40.4 ± 3.5 years; Exp 1 controls (n=9): 38.9 ± 10.5 years; Exp 2 patients (n=10): 35.3 ± 7.5 years; Exp 2 controls (n=10): 35.4 ± 8.9 years. Inclusion age range was 18-60 years.,Not reported,Denmark,"Participant demographics including sample size, gender, and age were detailed in the '2.1. Subjects' section. The country of study was inferred from the primary author affiliations and ethics committee location.","Clinical & Diagnostic, Biomechanics & Kinematics, Neurophysiology",1,1,1,0,0,42
111,"Dynamically evoked, discrete-threshold electromyography in the extreme lateral interbody fusion approach.","OBJECT: because the psoas muscle, which contains nerves of the lumbar plexus, is traversed during the extreme lateral interbody fusion (XLIF) approach, appropriate nerve monitoring is needed to avoid nerve injury during surgery and prevent approach-related neural deficit. This study was performed to assess the effectiveness of dynamically evoked electromyography (EMG) to detect and prevent neural injury during the XLIF approach. METHODS: one hundred two patients undergoing XLIF at L3-4 and/or L4-5 were enrolled in a prospective, multicenter, nonrandomized clinical study. The EMG threshold values for each of the 3 successive dilators were recorded at the surface of the psoas muscle, mid-psoas, and on the spine. At each location, the dilators were rotated 360??, taking recordings immediately posterior, superior, anterior, and inferior. For each dilator, the authors noted the rotational position (the angle in degrees) at which the lowest threshold was found. Findings of pre- and postoperative neurological examinations were also recorded. RESULTS: nerves were identified within proximity of the dilators (alert-level EMG feedback) in 55.7% of all cases during the XLIF approach. Although nerves were more commonly identified in the posterior margin (63%), there was significant variability in the location of nerves identified. Despite the fact that the posterior half of the disc space was targeted in 90% of cases, no significant long-lasting neural deficits were identified in any case; 27.5% experienced new iliopsoas/hip flexion weakness and 17.6% experienced new postoperative upper medial thigh sensory loss. Transient motor deficits were identified in 3 patients (2.9%), and all had resolved by the 6-month follow-up visit. CONCLUSIONS: the ability to identify and report a discrete, real-time EMG threshold during the transpsoas approach helps to avoid nerve injury and is required for the safe performance of the XLIF procedure. Additionally, nerve location is variable, thus reinforcing the need for real-time directional and proximity information.",2011,PubMed,Journal of Neurosurgery: Spine,"This article is an English-language evidence-based clinical study published in 2011. It reports in detail how electromyography (EMG) was used as the core monitoring tool to evaluate the avoidance of nerve damage in 102 real human patients during spinal fusion surgery, which perfectly met the screening criteria.",102,62 women and 40 men,"Mean 63 years, range 21-88 years",Not reported,USA,"Participant demographic data, including total number, gender breakdown, and age details, were found in the first paragraph of the 'Results' section. The study was conducted across 9 US centers as stated in the 'Methods' section.","Clinical & Diagnostic, Biomechanics & Kinematics, Neurophysiology, Sports & Ergonomics",0,1,1,1,0,67
112,Muscular timing and inter-muscular coordination in healthy females while walking.,"The dynamic interplay between muscles surrounding the knee joint, the central nervous system and external factors require a control strategy to generate and stabilise the preferred gait pattern. The electromyographic (EMG) signal is a common measure reflecting the neuromuscular control strategies during dynamic tasks. Neuromuscular control mechanisms, found in processed EMG signals, showed a precise pacing with a pacing rhythm and a tight control of muscle activity in running and maximally contracted muscles. The purpose of this study was to provide an insight how muscles get activated during walking. The EMG power, extracted by the wavelet transform (92-395Hz), over a time period encompassing 250ms before and 250ms after heel strike was analysed. The study showed that the wavelet-based analysis of EMG signals was sufficiently sensitive to detect a synchronisation of the activation of thigh muscles while walking. The results within each single subject and within the group consisting of 10 healthy females showed that, although there was a lot of jitter in the locations of the intensity peaks, the muscle activation is controlled, on average, by a neuromuscular activity paced at about 40ms, however with variable amplitudes. Albeit the jitter of the signal, the results resolved the temporal dependency of intensity peaks within muscles surrounding the knee and provided an insight into neural control of locomotion. The methodology to assess the stabilising muscle activation pattern may provide a way to discriminate subjects with normal gait pattern form those with a deteriorated neuromuscular control strategy.",2011,PubMed,Journal of Neuroscience Methods,"This peer-reviewed empirical study published in English in 2011 recruited real healthy female subjects and used surface electromyography (sEMG) as the core data collection technology to analyze the timing and coordination of muscle activation during walking, fully meeting all inclusion criteria.",10,10 females,48 ± 7 years,Not reported,Switzerland,"Participant demographics, including sample size, gender, and age, were explicitly stated in the '2.1. Subjects' section. Race and ethnicity were not reported.","Biomechanics & Kinematics, HCI & Prosthetics, Neurophysiology, Sports & Ergonomics",0,0,1,0,0,14
113,Muscle activation strategies during strength training with heavy loading vs. repetitions to failure.,"Going to failure, or not, has probably been one of the most debated issues during the history of strength training. However, few studies have directly compared the physiological effect of failure vs. nonfailure strength training. The purpose of this study was to evaluate muscle activation strategies with electromyography (EMG) during heavy repetitions vs. repetitions to failure with lighter resistance. Fifteen healthy untrained women performed a set with heavy loading (3 repetition maximum [RM]) and a set of repetitions to failure with lower resistance (???15 RM) during lateral raise with elastic tubing. Electromyographic amplitude and median power frequency of specific shoulder and neck muscles were analyzed, and the BORG CR10 scale was used to rate perceived loading immediately after each set of exercise. During the failure set, normalized EMG was significantly lower during the first repetition and significantly higher during the latter repetitions compared with the heavy 3-RM set (p < 0.05). Normalized EMG for the examined muscles increased throughout the set to failure in a curvilinear fashion--e.g., for the trapezius from 86 to 124% maximal voluntary contraction (p < 0.001)--and reached a plateau during the final 3-5 repetitions before failure. Median power frequency for all examined muscles decreased throughout the set to failure in a linear fashion, indicating progressively increasing fatigue. In conclusion, going to complete failure during lateral raise is not necessary to recruit the entire motor unit pool in untrained women--i.e., muscle activity reached a plateau 3-5 repetitions from failure with an elastic resistance of approximately 15 RM. Furthermore, strengthening exercises performed with elastic tubing seem to be an efficient resistance exercise and a feasible and practical alternative to traditional resistance equipment.",2012,PubMed,Journal of Strength and Conditioning Research,"This original research study uses surface EMG as a primary outcome measure to investigate muscle activation in human participants, meeting all inclusion criteria.",15,15 Females,Mean 42.2 ± 9.1 years,Not reported,Denmark,"Participant demographic information, including sample size, gender, and age, was located in the 'Subjects' subsection within the 'Methods' section. The country of study was identified from the author affiliations listed on the first page.","Rehabilitation & Therapy, Neurophysiology, Sports & Ergonomics",0,1,1,0,0,18.2
114,Comparison of ambulatory and polysomnographic recording of jaw muscle activity during sleep in normal subjects.,"Clinicians and investigators need a simple and reliable recording device to diagnose or monitor sleep bruxism (SB). The aim of this study was to compare recordings made with an ambulatory electromyographic telemetry recorder (TEL-EMG) with those made with standard sleep laboratory polysomnography with synchronised audio-visual recording (PSG-AV). Eight volunteer subjects without current history of tooth grinding spent one night in a sleep laboratory. Simultaneous bilateral masseter EMG recordings were made with a TEL-EMG and standard PSG. All types of oromotor activity and rhythmic masseter muscle activity (RMMA), typical of SB, were independently scored by two individuals. Correlation and intra-class coefficient (ICC) were estimated for scores on each system. The TEL-EMG was highly sensitive to detect RMMA (0??988), but with low positive predictive value (0??231) because of a high rate of oromotor activity detection (e.g. swallowing and scratching). Almost 72% of false-positive oromotor activity scored with the TEL-EMG occurred during the transient wake period of sleep. A non-significant correlation between recording systems was found (r = 0??49). Because of the high frequency of wake periods during sleep, ICC was low (0??47), and the removal of the influence of wake periods improved the detection reliability of the TEL-EMG (ICC = 0??88). The TEL-EMG is sensitive to detect RMMA in normal subjects. However, it obtained a high rate of false-positive detections because of the presence of frequent oromotor activities and transient wake periods of sleep. New algorithms are needed to improve the validity of TEL-EMG recordings.",2012,PubMed,Journal of Oral Rehabilitation,"This is an original empirical study published in 2012 that compares two EMG recording methods (ambulatory vs. polysomnography) in human subjects, meeting all inclusion criteria.",8,four women and four men,mean age ± s.d. = 26.9 ± 10.9 years; range = 17-49 years,Not reported,Canada,"All participant demographic data was found in the first paragraph of the 'Methods' section, under the 'Subjects' subsection. Race and ethnicity were not reported.",Other / General,1,1,1,0,0,32
115,Type 2 diabetes mellitus patients manifest characteristic spatial EMG potential distribution pattern during sustained isometric contraction.,"AIM: The purpose of the present study is to investigate spatial surface electromyography (SEMG) potential distribution pattern in type 2 diabetes mellitus (T2DM) patients. METHODS: Nine T2DM patients and nine age-matched healthy men (CON) performed a sustained isometric knee extension at 10% of maximal voluntary contraction for 120s. Multi-channel SEMG was recorded from the vastus lateralis muscle by means of 64 electrodes. To characterize spatial SEMG potential distribution pattern, modified entropy and correlation coefficients between same electrode locations were calculated at 15, 60 and 120s for the root mean square values. RESULTS: At 60 and 120s, modified entropy in T2DM was significantly lower than those in CON (p<0.05). Correlation coefficients for T2DM were significantly higher than those for CON at 60 and 120s (p<0.05). CONCLUSION: From these results, we suggested that T2DM patients continue to recruit limited and same motor units during the sustained contraction at low force level.",2012,PubMed,Diabetes Research and Clinical Practice,"This is a primary empirical research article published in 2012, investigating human muscle activation using multi-channel surface EMG as its core methodology.",18,18 men,T2DM group: 70.6 ± 6.7 years; CON group: 72.6 ± 3.8 years,Not reported,Japan,"Participant numbers, gender, and age were detailed in the '2.1. Subjects' section and in Table 1. Race and ethnicity were not reported.","Clinical & Diagnostic, Biomechanics & Kinematics, Sports & Ergonomics",0,0,0,1,0,12.5
116,Quantitative electromyography improves prediction in vocal fold paralysis.,"OBJECTIVES: Quantitative laryngeal electromyography (LEMG) using turns analysis can differentiate acute vocal fold paralysis from normal controls. The objective of this study is to determine if using both traditional qualitative LEMG measurements in addition to turns analysis improves prognostic accuracy in patients with acute vocal fold paralysis who demonstrate voluntary motor activity. STUDY DESIGN: Retrospective review of LEMG data (qualitative and quantitative) and charts of patients with vocal fold paralysis on flexible laryngoscopy, recurrent laryngeal neuropathy, and varying degrees of motor unit recruitment. METHODS: Laryngeal EMG using a standardized protocol involving qualitative (evaluation of recruitment, motor unit configuration, detection of fibrillations, synkinesis) and quantitative (turns analysis) measurements was performed. Prognosis was correlated with vocal fold motion recovery status (minimum of 6 months following onset) using positive and negative predictive values (PPV, NPV). RESULTS: Twenty-three patients underwent LEMG for acute recurrent laryngeal neuropathy. All four patients with excellent LEMG prognosis recovered motion, whereas 17/19 patients with fair/poor LEMG prognosis were without motion at least 6 months following onset, resulting in a 100% PPV and 89.5% NPV. CONCLUSIONS: Integrating both qualitative and quantitative LEMG data improves prognostic accuracy in vocal fold paralysis patients who demonstrate voluntary motor unit activity.",2012,PubMed,The Laryngoscope,"The paper is a primary empirical study using laryngeal electromyography (LEMG) as a core modality on human patients, published in English in a peer-reviewed journal in 2012.",23,73.9% female,Mean 52.7 ± 14.6 years,Not reported,U.S.A.,Participant demographic data was found in the first paragraph of the 'Results' section and in Table I. Race and ethnicity were not reported.,"Clinical & Diagnostic, Rehabilitation & Therapy, HCI & Prosthetics, Neurophysiology",0,0,1,1,0,29.2
